id,name,category,area,url,description,phone,address,hours,closed,fee,access,parking,website
"11370","種子島時堯像 （タネガシマトキタカゾウ） 登録済み 解除する 行きたい","","","https://www.kagoshima-kankou.com/guide/11370/","","0997-22-1111（西之表市教育委員会）","鹿児島県西之表市西之表","","","","［車］ ・西之表港から約5分 ・種子島空港から約25分","無","http://www.city.nishinoomote.lg.jp/kanko/goaround/2336.html"
"52150","大出水の湧水 （オオデミズノユウスイ） 登録済み 解除する 行きたい","","","https://www.kagoshima-kankou.com/guide/52150/","","0995-45-5111（霧島市観光PR課）","鹿児島県霧島市横川町","","","なし","［車］ ・九州自動車道横川ＩＣから約20分 ・ＪＲ肥薩線霧島温泉駅から約12分","普通車：10台 （無料）","https://www.city-kirishima.jp/kirikan/kanko/leisure/yokogawa/sisetu.html"
"50360","湯治の宿 田島本館 （トウジノヤド タジマホンカン） 登録済み 解除する 行きたい","","","https://www.kagoshima-kankou.com/guide/50360/","","0995-77-2205","鹿児島県霧島市牧園町宿窪田4236","8：30～20：00","無休","","［車］ ・鹿児島空港より約20分 ・九州自動車道・溝辺鹿児島空港ＩＣより約20分","有","https://tajimahonkan.com/"
"51259","屋久杉自然館 （やくすぎしぜんかん） 登録済み 解除する 行きたい","","","https://www.kagoshima-kankou.com/guide/51259/","","0997-46-3113","鹿児島県熊毛郡屋久島町安房2739-343","9：00～17：00（入館16：30まで）","・毎月第一火曜日 ・年末年始（12/29～1/1）","［入館料］ 大人 600円 高校/大学生 400円 小中学生 300円 ※団体割引等、各種割引あり ［体験料］ ・やくすぎキーホルダー・ストラップ作り 500円/人 ・森の時計作り 2,500円/人（団体割引あり） ※体験はそれぞれ事前予約が必要で、受付期間が異なります。詳細は公式サイトにてご確認ください。","［車］ ・宮之浦港から約35分","有","http://yakusugi-museum.com/"
"53483","種子島マングローブパーク （タネガシママングローブパーク） 登録済み 解除する 行きたい","","","https://www.kagoshima-kankou.com/guide/53483/","","0997-26-1111（南種子町役場）","鹿児島県熊毛郡南種子町","","","","［車］ ・種子島空港から約30分 ・西之表港から約50分","有","https://www.manglobal.or.jp/tanegashima/"
"52790","高千穂河原 （タカチホガワラ） 登録済み 解除する 行きたい","","","https://www.kagoshima-kankou.com/guide/52790/","","0995-45-5111（霧島市観光PR課）","鹿児島県霧島市田口高千穂河原","紅葉の見頃（例年）／11月上旬","","無料","［車］ ・九州自動車道「溝辺鹿児島空港ＩＣ」から約50分 ［バス］ ・ＪＲ日豊本線「霧島神宮」駅より、霧島いわさきホテル行きバスで約30分、「丸尾」乗換え、霧島連山周遊バスで約60分、「高千穂河原」下車","有（有料）",""
"53365","栄屋旅館・阿久根温泉ぼんたん湯 （サカエヤリョカン・アクネオンセンボンタンユ） 登録済み 解除する 行きたい","","","https://www.kagoshima-kankou.com/guide/53365/","","0996-72-1431","鹿児島県阿久根市大丸町94番地","","","［入浴料］大人350円、小人130円","［車］ ・肥薩おれんじ鉄道「阿久根駅」から約4分","有","http://go-akune.jp/spots/detail/206"
"10438","大宮神社（君が代発祥の地） （オオミヤジンジャ） 登録済み 解除する 行きたい","","","https://www.kagoshima-kankou.com/guide/10438/","","0996-44-2390（大宮神社）／0996-44-5200（入来麓観光案内所）","鹿児島県薩摩川内市入来町浦之名","","無休","","［車］ ・九州自動車道・姶良ＩＣから約25分 ・ＪＲ川内駅から約25分","","https://satsumasendai.gr.jp/spotlist/1854"
"50941","国民宿舎レインボー桜島 （コクミンシュクシャレインボーサクラジマ） 登録済み 解除する 行きたい","","","https://www.kagoshima-kankou.com/guide/50941/","","050-3161-9613","鹿児島県鹿児島市桜島横山町1722-16","立寄り湯 11：00～21：00（20：00受付終了）","","","[車] ・鹿児島空港から国道220号線経由で約1時間12分 ・鹿児島空港から九州自動車道、桜島フェリー経由で約1時間30分 ・鹿児島中央駅から桜島フェリー経由で約1時間","有","http://www.rainbow-sakurajima.com/"
"70759","錦江湾釣り体験【日登美丸】 （きんこうわんつりたいけん【ひとみまる】） 登録済み 解除する 行きたい","","","https://www.kagoshima-kankou.com/guide/70759/","","090-6776-6930","〒892-0823 鹿児島県鹿児島市住吉町１５番地","","","・手ぶらコース お一人様 8,000円（税込） ・小学生以下のお子様 4,000円（税込） ・お一人様(半日) 6,000円（税込） ・半日チャーター 40,000円（税込） ・1日チャーター 70,000円（税込） ※詳しくは公式ホームページをご確認ください。","","有り","https://hitomimaru.com/index.html"
"10539","鹿児島市立科学館 （かごしましりつかがくかん） 登録済み 解除する 行きたい","","","https://www.kagoshima-kankou.com/guide/10539/","","099-250-8511","〒890-0063 鹿児島県鹿児島市鴨池2-31-18","9:30～18:00（入館は17:30まで）","火曜日（休日の場合は翌平日）、12月29日～1月1日","【市民料金】 大人600円、小人220円 【市外料金】 大人800円、小人300円 ※プラネタリウム・ドームシネマ観覧料は別途","・市電「郡元」から徒歩約10分 ・市営バス「鴨池市営プール前」下車","敷地内にパーキングパーミット用スペース２台分あり その他は隣接の鴨池公園駐車場を利用（普通車あり バスあり）","https://www.k-kagaku.jp/"
"10566","烏島展望所 （からすじまてんぼうじょ） 登録済み 解除する 行きたい","","","https://www.kagoshima-kankou.com/guide/10566/","","099-216-1327（鹿児島市観光振興課）","〒891-1420 鹿児島県鹿児島市桜島赤水町3629-12","","","","・サクラジマアイランドビュー「烏島展望所」下車 ・桜島港桜島フェリーターミナルから徒歩約25分","","https://www.kagoshima-yokanavi.jp/article/sakurajima"
"50908","霧島アート牧場 （キリシマアートボクジョウ） 登録済み 解除する 行きたい","","","https://www.kagoshima-kankou.com/guide/50908/","","0995-74-1333","鹿児島県姶良郡湧水町木場6340-70","","","コース、宿泊形態によって異なります。詳細は公式サイトにてご確認ください。","［車］ ・鹿児島空港より約30分 ・栗野ＩＣより約15分","有","http://www.kirishimaart.co.jp/"
"10535","磯海水浴場 （いそかいすいよくじょう） 登録済み 解除する 行きたい","","","https://www.kagoshima-kankou.com/guide/10535/","","099-248-3006（磯ビーチハウス※開設期間中 鹿児島市スポーツ課（TEL：099-803-9621）※開設期間中 鹿児島市河川港湾課（TEL：099-216-1412）※開設期間外）","〒892-0871 鹿児島県鹿児島市吉野町9684-2","","","","・JR仙巌園駅から徒歩3分 ・鹿児島中央駅からカゴシマシティビューで約50分「仙巌園前」下車徒歩約3分 ・JR鹿児島中央駅から車で約30分 ・JR鹿児島駅から車で約15分","","https://www.city.kagoshima.lg.jp/sports/shisetsu/kanko/013.html"
"11043","清水磨崖仏 （キヨミズマガイブツ） 登録済み 解除する 行きたい","","","https://www.kagoshima-kankou.com/guide/11043/","","0993-83-4433（南九州市文化財課）","〒897-0202 鹿児島県南九州市川辺町清水3882","","無休","無料","［車］ ・九州自動車道～指宿スカイライン～川辺ＩＣ～国道225号（川辺ＩＣから約10分） ［電車・タクシー・バス］ ・ＪＲ鹿児島中央駅下車～鹿児島交通（川辺経由枕崎行き）～川辺やすらぎの郷バス停下車（徒歩30分）","有","https://www.city.minamikyushu.lg.jp/kankosite/kankospot/3/5553.html"
"60012","道の駅山川港 活お海道 （みちのえきやまがわこう いおかいどう） 登録済み 解除する 行きたい","","","https://www.kagoshima-kankou.com/guide/60012/","","0993-27-6507","〒891-0506 鹿児島県指宿市山川金生町1-10","■売店 8:30～17:30 ■レストラン 11:00～15:00","第3水曜日（祝日の場合は翌日）","","JR山川駅から車で5分","普通車69台、大型車2台","http://io-kaido.com/"
"10376","ねじめ温泉ネッピー館 （ネジメオンセンネッピーカン） 登録済み 解除する 行きたい","","","https://www.kagoshima-kankou.com/guide/10376/","","0994-24-5300","鹿児島県肝属郡南大隅町根占川南732","［入浴］7：00～22：00","毎月第2月曜日（※月曜日が祝祭日の場合は翌日）","","［車］ ・垂水港から約50分 ・鹿屋市内から約30分 ・根占港から徒歩約1分","有","http://www.neppie-spa.com/"
"10523","ザビエル公園 （ザビエルコウエン） 登録済み 解除する 行きたい","","","https://www.kagoshima-kankou.com/guide/10523/","","","鹿児島県鹿児島市東千石町4-1","","無休","","［市電］ ・「高見馬場」電停下車、徒歩約8分","なし","https://www.kagoshima-yokanavi.jp/spot/10152"
"10198","奄美海洋展示館 （アマミカイヨウテンジカン） 登録済み 解除する 行きたい","","","https://www.kagoshima-kankou.com/guide/10198/","","0997-55-6000","鹿児島県奄美市名瀬小宿大浜701番地1","9：30～18：00（入館は17：30まで）","年末年始（12/31～1/1） ※メンテナンスの為の休館日あり （6月・12月の中旬3日間）","大人：700円 小人：400円 幼児：150円 3歳以下：無料 ※団体割引あり、詳細は公式サイトにてご確認ください","［バス］ （名瀬市街地から） ・「今里」行き乗車、最寄りバス停「大浜入口」下車、徒歩約15分 ※空港・港からのアクセスにつきましては、公式サイトにてご確認いただけます","有","https://www.ohama.marutani-amami.com/ocean-exhibition-hall"
"51325","原ハブ屋奄美 （ハラハブヤアマミ） 登録済み 解除する 行きたい","","","https://www.kagoshima-kankou.com/guide/51325/","","0997-63-1826（有限会社 原ハブ屋奄美）","鹿児島県奄美市笠利町平字土浜1295-1","9：30～18：00","不定休","［ショー観覧料］ 高校生以上：800円 小・中学生：500円 ※要予約 ※詳細は公式サイトにてご確認ください","［車］ ・奄美空港から約10分 ・名瀬から約40分","有","https://www.harahabuya.com/"
"10616","東温泉 （ヒガシオンセン） 登録済み 解除する 行きたい","","","https://www.kagoshima-kankou.com/guide/10616/","","0991-32-2370（三島村観光案内所）","鹿児島県鹿児島郡三島村硫黄島","","","","［車］ ・硫黄島港から約10分","有り","http://mishimamura.com/"
"50934","グリーンファーム喜入（鹿児島市観光農業公園） （ぐりーんふぁーむきいれ（かごしましかんこうのうぎょうこうえん）） 登録済み 解除する 行きたい","","","https://www.kagoshima-kankou.com/guide/50934/","","099-345-3337","〒891-0204 鹿児島県鹿児島市喜入一倉町5809-97","11月～3月 9:00～17:00 4月～10月 8:30～18:00","12月29日～1月1日","","・JR鹿児島中央駅から車で約1時間 ・JR「喜入駅」から車で約10分","あり","http://kankonogyo-park.jp/"
"10427","いこいの森 丸山公園 （イコイノモリ マルヤマコウエン） 登録済み 解除する 行きたい","","","https://www.kagoshima-kankou.com/guide/10427/","","0996-37-2300（薩摩川内市民まちづくり公社）","〒895-1202 鹿児島県薩摩川内市樋脇町塔之原","","","","ＪＲ川内駅より車で20分","50台","https://satsumasendai.gr.jp/spotlist/1691/"
"10538","鹿児島県立博物館 （かごしまけんりつはくぶつかん） 登録済み 解除する 行きたい","","","https://www.kagoshima-kankou.com/guide/10538/","","099-223-6050","鹿児島県鹿児島市城山町1-1","9：00～17：00 （入館は16：30まで）","・月曜（祝日の場合は翌日） ・毎月25日（土日開館） ・原則偶数月の第2火曜日、9月上旬の1日間（全館燻蒸） ・12月29日～1月1日（4日間）","本館と恐竜化石展示室は無料 ［プラネタリウム］ 高校生以上 230円 小・中学生 130円 ※団体割引あり。詳細は公式サイトをご確認ください","［バス］ ・「天文館」バス停下車、徒歩約7分 ［鹿児島市電］ ・「天文館通」電停下車、徒歩約7分","無 （※近辺の有料駐車場をご利用ください）","http://www.pref.kagoshima.jp/hakubutsukan"
"51934","川内高城温泉 （センダイタキオンセン） 登録済み 解除する 行きたい","","","https://www.kagoshima-kankou.com/guide/51934/","","0996-28-1362（せんだい高城温泉よか湯協議会（高城の湯山桜桃内））","鹿児島県薩摩川内市湯田町","施設によって異なる","施設によって異なる","※施設によって異なります ［大人］200円～350円 ［子供］100円～150円","［車］ 川内駅から国道3号、県道340号線を経由し約35分","無料駐車場有","http://www.sendaitakionsen.com/"
"51484","山川製塩工場跡 （やまがわせいえんこうじょうあと） 登録済み 解除する 行きたい","","","https://www.kagoshima-kankou.com/guide/51484/","","0993-22-2111（指宿市役所観光課）","鹿児島県指宿市","","","無料","・ＪＲ山川駅から車で10分 ・ヘルシーランド露天風呂「​​​​​​​たまて箱温泉」の駐車場から徒歩すぐ","約50台","http://www.ibusuki.or.jp/tourism/view/fushime/"
"30119","忘れの里雅叙苑 （ワスレノサトガジョエン） 登録済み 解除する 行きたい","","","https://www.kagoshima-kankou.com/guide/30119/","","0995-77-2114","鹿児島県霧島市牧園町宿窪田4230","［ランチ+立寄り湯］12：00～15：00","","","［車］ ・九州自動車道・溝辺鹿児島空港ＩＣより約20分","有","http://gajoen.jp/"
"10377","諏訪神社 並立鳥居 （スワジンジャ ヘイリツトリイ） 登録済み 解除する 行きたい","","","https://www.kagoshima-kankou.com/guide/10377/","","0994-24-3115（南大隅町商工観光課）","鹿児島県肝属郡南大隅町根占川南5076","","無休","","・垂水港から車で約1時間 ・南大隅町役場から車で約5分","なし","https://www.kagojinjacho.or.jp/shrine-search/area-oosumi/%E5%8D%97%E5%A4%A7%E9%9A%85%E7%94%BA/831/"
"50264","志布志湾大黒イルカランド （シブシワンダイコクイルカランド） 登録済み 解除する 行きたい","","","https://www.kagoshima-kankou.com/guide/50264/","","0987-27-3939","宮崎県串間市大字高松1481-3","［イルカランド］ ・10：00～17：00(通年） ※夏季・繁忙期は時間延長あり ［海鮮市場］ ・10：00～18：00","月毎に休館日が異なります。詳細は公式サイトにてご確認ください。 ※大雨・台風による臨時休館にご注意ください","［入場料］ 高校生以上 1,500円 小中学生 1,000円 3才以上 700円 2才以下 無料（大人1名の有料入場につき2名まで） ※ふれあい体験コースは別途料金が必要です。詳細は公式サイトにてご確認ください。 ※団体割引、年間パスポートあり。","［車］ ・曽於弥五郎ICより約40分 ・鹿児島空港より約80分 ・鹿児島中央駅より約100分 ・鹿児島港より約120分 ・垂水港より約90分","有","http://www.irukaland.com"
"10248","高知山展望台 （こうちやまてんぼうだい） 登録済み 解除する 行きたい","","","https://www.kagoshima-kankou.com/guide/10248/","","0997-72-1001（奄美せとうち観光協会）","鹿児島県大島郡瀬戸内町大字久根津","","","","［車］ ・奄美空港から約1時間40分 ・名瀬港から約1時間 ・古仁屋から約15分","有","https://www.setouchi-welcome.com/spotinfo/%E9%AB%98%E7%9F%A5%E5%B1%B1%E5%B1%95%E6%9C%9B%E5%8F%B0"
"10743","浦田海水浴場 （ウラダカイスイヨクジョウ） 登録済み 解除する 行きたい","","","https://www.kagoshima-kankou.com/guide/10743/","","0997-22-1111（（内線273）西之表市役所）","鹿児島県西之表市国上浦田89-1","9：00～18：30","開設期間中は無休","キャンプ場の利用料金表は、公式サイトをご覧ください","［車］ ・西之表港より約25分","有","http://www.city.nishinoomote.lg.jp/kanko/course/2774.html"
"70295","IKEDAKO PAX（いけだ湖パクス） （いけだこぱくす） 登録済み 解除する 行きたい","","","https://www.kagoshima-kankou.com/guide/70295/","","0993-23-1411","鹿児島県指宿市池田5123番地7","9：00～18：00 サマータイム営業時間：7・8月 9：00～19：00","なし","","［車］ ・鹿児島空港から約1時間35分（高速利用） ・鹿児島市から約1時間20分 ・ＪＲ指宿駅から約20分 ［バス］ JR指宿駅から1時間4分(池田湖停留所からすぐ)","あり","https://ikedakopax.jp/"
"30721","指宿フェニックスホテル （イブスキフェニックスホテル） 登録済み 解除する 行きたい","","","https://www.kagoshima-kankou.com/guide/30721/","","0993-23-4111","鹿児島県指宿市十二町4320","","","［入浴］大人550円、子供275円 ［砂むし温泉］大人1,200円、子供600円","［車］ ・ＪＲ指宿駅から約5分（徒歩約30分）","有","http://www.phoenixhotel.co.jp/"
"51225","ＪＲ吉松駅 （ヨシマツエキ） 登録済み 解除する 行きたい","","","https://www.kagoshima-kankou.com/guide/51225/","","0995-74-3111（湧水町商工観光課）","鹿児島県姶良郡湧水町川西968","","","","","","http://www.kagoshima-kankou.com/guide/51328/"
"51956","猿ヶ城ラドン温泉 （サルガジョウラドンオンセン） 登録済み 解除する 行きたい","","","https://www.kagoshima-kankou.com/guide/51956/","","0994-38-6117（フリーコールなし）","鹿児島県垂水市新御堂鍋ヶ久保1337-10","10:00～19:00（閉館）","毎週平日の火曜日（祝日除く）","※公式サイトをご覧ください","［車］ ・ＪＲ鹿児島中央駅から約1時間 ・垂水フェリー港から約10分","有","https://sarugajyoradon.jp/"
"51955","猿ヶ城渓谷 森の駅たるみず （サルガジョウケイコク モリノエキタルミズ） 登録済み 解除する 行きたい","","","https://www.kagoshima-kankou.com/guide/51955/","","0994-32-9601（森の駅たるみず）","鹿児島県垂水市新御堂1344-1","8：30～17：00","年中無休","※公式サイトにてご確認ください","［車］ ・鹿児島空港から国道220号線を垂水方面へ約1時間25分 ・志布志港から約80分 ・垂水フェリー乗り場から約10分","有","https://sarugajyo.jp/"
"10879","道の駅きんぽう「木花館」 （ミチノエキキンポウ「コノハナカン」） 登録済み 解除する 行きたい","","","https://www.kagoshima-kankou.com/guide/10879/","","0993-77-3833","鹿児島県南さつま市金峰町池辺1383番地","［店舗・売店］ 9:00～17:00 ［レストラン］ 11:00～14:30","・毎月第2火曜日","［そば打ち体験］(予約制) 2,980円/人 テーブル1台の料金となります。4人分のそばが作れます。自分で打ったそばが食べられます。持ち帰りも可。 ※2名様～1人550円追加","［車］ ・鹿児島空港から、九州自動車道、指宿スカイライン谷山ＩＣ経由で約60分 ・鹿児島市から、鹿児島ＩＣ、指宿スカイライン谷山ＩＣ経由で約35分","有","http://www5.synapse.ne.jp/konohanakan/"
"10796","城山公園（一宇治城跡） （ジョウヤマコウエン（イチウジジョウアト）） 登録済み 解除する 行きたい","","","https://www.kagoshima-kankou.com/guide/10796/","","099-248-9409（日置市商工観光課）","鹿児島県日置市伊集院町大田700","","無休","無料","・ＪＲ「伊集院駅」から車で約3分 ・ＪＲ「伊集院駅」から徒歩約10分 ・南九州西回り自動車道「伊集院ＩＣ」から車で約5分","有","https://www.city.hioki.kagoshima.jp/kanko/kankou/kanko-map/osusume/joyamakoen.html"
"10897","市来ふれあい温泉センター （イチキフレアイオンセンセンター） 登録済み 解除する 行きたい","","","https://www.kagoshima-kankou.com/guide/10897/","","0996-21-5022","鹿児島県いちき串木野市湊町１丁目100","7:00〜22:00（最終入館時間 21:30） ※毎月第2月曜日は、16:00〜22:00","なし","大人※中学生以上 350円 シルバー※70歳以上 300円 小学生 150円 幼児 ※未熟学児 無料 家族風呂 1,500円（1時間）","・市来駅から車で約8分 ・ＪＲ鹿児島中央駅から在来線で約50分","有","https://ichiki.onsen.center/"
"10261","宮古崎 （ミヤコザキ） 登録済み 解除する 行きたい","","","https://www.kagoshima-kankou.com/guide/10261/","","0997-57-2117（大和村企画観光課）","〒894-3101 鹿児島県大島郡大和村国直","","","","［車・徒歩］ ・奄美市名瀬より車で約25分、宮古崎トンネルを抜けてすぐ右折。駐車場から岬までは徒歩約20分","有り（遊歩道入口前）","https://www.vill.yamato.lg.jp/kikaku/shisetsu/kanko-spot/002.html"
"30940","くしき野白浜温泉みすまるの湯 （クシキノシラハマオンセンミスマルノユ） 登録済み 解除する 行きたい","","","https://www.kagoshima-kankou.com/guide/30940/","","0996-35-0031","鹿児島県いちき串木野市羽島265-4","8：00～22：00","木曜日","","［車］ ・串木野駅から約15分 ・串木野ＩＣから約15分","有","https://www.instagram.com/kushikino_shirahama_onsen?igsh=Y2htbGhsOGw2Zmlk"
"50388","串良平和公園 （クシラヘイワコウエン） 登録済み 解除する 行きたい","","","https://www.kagoshima-kankou.com/guide/50388/","","0994-31-1148（鹿屋市都市政策課公園管理室）","鹿児島県鹿屋市串良町有里5660-1","","","","［車］ ・細山田ＩＣから約10分 ・鹿屋市街地から約20分","有","https://oosumi-kankou.com/topics/%E4%B8%B2%E8%89%AF%E5%B9%B3%E5%92%8C%E5%85%AC%E5%9C%92/"
"10976","悠久の森 （ユウキュウノモリ） 登録済み 解除する 行きたい","","","https://www.kagoshima-kankou.com/guide/10976/","","0986-28-0111（（一社）曽於市観光協会）","鹿児島県曽於市財部町下財部6473-1","","","無料","［車］ ・鹿児島市内から約1時間30分 ・霧島温泉郷から約30分","有","https://soo-navi.jp/spot/2046/"
"10730","屋久島環境文化村センター （ヤクシマカンキョウブンカムラセンター） 登録済み 解除する 行きたい","","","https://www.kagoshima-kankou.com/guide/10730/","","0997-42-2900","鹿児島県熊毛郡屋久島町宮之浦823-1","9：00～17：00 （展示ホールへの入場は16：30まで）","月曜（祝日の場合は翌日） 年末年始（12/28～1/1） ※4月29日～5月5日・7月20日～8月までは休館日なし 年末年始（12月28日～1月1日）","※展示ホール及び大型映像については観覧料が必要です。 大人 530円 高・大学生 370円 小・中学生 270円 幼児（6歳未満） 無料 ※団体割引あり、詳細は公式サイトにてご確認ください","［徒歩］ ・宮之浦港から約5分 ［バス・タクシー］ ・屋久島空港から約25分（タクシー約20分) ・安房港から約40分（タクシー約30分)","有","http://www.yakushima.or.jp/static/village.php"
"10147","龍門司坂 （タツモンジザカ） 登録済み 解除する 行きたい","","","https://www.kagoshima-kankou.com/guide/10147/","","0995-67-6052（姶良市観光協会）","鹿児島県姶良市加治木町木田5088-1","","","無料","［車］ ・九州自動車道・加治木ＩＣから約5分 ・鹿児島市から約40分 ［徒歩］ ・ＪＲ日豊本線加治木駅から約20分","8台","https://aira-kankou.jp/spot/6196/"
"50942","指宿温泉郷 （イブスキオンセンキョウ） 登録済み 解除する 行きたい","","","https://www.kagoshima-kankou.com/guide/50942/","","0993-22-3252（指宿市観光協会）","鹿児島県指宿市","","","","","","http://www.ibusuki.or.jp/spa/"
