id,name,category,area,url,description,phone,address,hours,closed,fee,access,parking,website
"70113","仙巌園ブランドショップ （せんがんえんぶらんどしょっぷ） 登録済み 解除する 行きたい","","","https://www.kagoshima-kankou.com/guide/70113/","","099-247-1551","〒892-0871 鹿児島県鹿児島市吉野町9700-1","9:00～17:00","3月第1日曜日（鹿児島マラソンの為）","※仙巌園入場料が必要","・JR仙巌園駅下車すぐ ・鹿児島中央駅からカゴシマシティビューで約50分「仙巌園前」下車 ・JR鹿児島中央駅から車で約20分","普通車あり バスあり","https://www.senganen.jp/"
"53512","そうめん流し 大野庵 （そうめんながし おおのあん） 登録済み 解除する 行きたい","","","https://www.kagoshima-kankou.com/guide/53512/","","0996-79-2130","鹿児島県阿久根市鶴川内6686-4","11：00～15：00（オーダーストップ 14：30） ※営業カレンダー等の最新情報はInstagramやXをご確認下さい。","","","［車］ ・鹿児島空港から約1時間20分 ・南九州道阿久根ＩＣから約10分 ・肥薩おれんじ鉄道阿久根駅から約15分","有","https://www.instagram.com/ohnoan/"
"52501","大久保利通生い立ちの地 （おおくぼとしみちおいたちのち） 登録済み 解除する 行きたい","","","https://www.kagoshima-kankou.com/guide/52501/","","099-216-1327（鹿児島市観光振興課）","〒892-0846 鹿児島県鹿児島市加治屋町","","","","・鹿児島中央駅から徒歩約8分 ・カゴシマシティビュー維新ふるさと館（観光交流センター）下車徒歩約2分","","https://www.kagoshima-yokanavi.jp/article/meijiishin"
"51130","旅の駅桜島 桜島物産館 （タビノエキサクラジマ サクラジマブッサンカン） 登録済み 解除する 行きたい","","","https://www.kagoshima-kankou.com/guide/51130/","","099-293-3558","鹿児島県鹿児島市桜島赤水町1427","9：00～16：00 ※新型コロナウイルスの影響により、団体様のご予約時のみオープン。要事前に問合せ。","","","","","https://www.omiyage-jp.com/"
"51470","南方神社 （ミナミカタジンジャ） 登録済み 解除する 行きたい","","","https://www.kagoshima-kankou.com/guide/51470/","","0993-72-2629","鹿児島県枕崎市鹿篭麓町398","","無休","無料","ＪＲ枕崎駅から車で約10分","有","https://minakatajinja.com/"
"10605","丹後局墓所 （たんごのつぼねぼしょ） 登録済み 解除する 行きたい","","","https://www.kagoshima-kankou.com/guide/10605/","","099-216-1327（鹿児島市観光振興課）","鹿児島県鹿児島市花尾町4193","","無休","無料","鹿児島市中心地よりＪＲ九州バス「川田経由郡山」行き56分、「花尾神社前」下車徒歩3分","20台",""
"51628","戦闘指揮所跡 （セントウシキショアト） 登録済み 解除する 行きたい","","","https://www.kagoshima-kankou.com/guide/51628/","","0997-65-3683（喜界町役場企画観光課）","鹿児島県大島郡喜界町中里","","無し","無料","［車］ ・喜界空港から約1分","無し","https://kikaijimanavi.com/history_and_culture/historic-sites/3923/"
"10230","空港臨海公園キャンプ場 （クウコウリンカイコウエンキャンプジョウ） 登録済み 解除する 行きたい","","","https://www.kagoshima-kankou.com/guide/10230/","","0997-65-1855","鹿児島県大島郡喜界町湾451-1","ゴルフ場の受付 4～9月は8:00～15:30 10～3月は8:00～14:30","水曜（ゴルフ場のみ）","※料金詳細はお問い合わせください","［車］ ・空港から約5分","有り","https://www.town.kikai.lg.jp/kankou/shisetsu/kanko/002.html"
"10780","宇宙ヶ丘公園 （ウチュウガオカコウエン） 登録済み 解除する 行きたい","","","https://www.kagoshima-kankou.com/guide/10780/","","0997-26-1111（南種子町建設課）","鹿児島県熊毛郡南種子町中之下","","","","［車］ ・西之表港から約60分 ・種子島空港から約40分","有","http://www.town.minamitane.kagoshima.jp/institution/ucyugaokapark.html"
"51313","南さつま海道八景 （ミナミサツマカイドウハッケイ） 登録済み 解除する 行きたい","","","https://www.kagoshima-kankou.com/guide/51313/","","0993-53-2111（南さつま市観光交流課）","鹿児島県南さつま市","","","","","","http://kanko-minamisatsuma.jp/"
"11637","里麓武家屋敷通り／手打武家屋敷通り （サトフモトブケヤシキトオリ／テウチブケヤシキドオリ） 登録済み 解除する 行きたい","","","https://www.kagoshima-kankou.com/guide/11637/","","09969-6-3930（上甑島観光案内所）","鹿児島県薩摩川内市里町里","","","","［徒歩］ ・里港から徒歩約10分","有","https://satsumasendai.gr.jp/spotlist/4359/"
"70127","城山シーズニング （しろやましーずにんぐ） 登録済み 解除する 行きたい","","","https://www.kagoshima-kankou.com/guide/70127/","","099-213-9554","〒892-0853 鹿児島県鹿児島市城山町7-2 黎明館1F","10:00-17:00 [ランチ]11:00-14:00（LO13:30）","月曜日（祝日の時は翌日） 毎月25日（土曜日・日曜日のときは営業）","","・カゴシマシティビュー「薩摩義士碑前」下車徒歩約1分 ・市電「市役所前」から徒歩約10分","あり","https://sakurakaneyo.com/s-seazoning/"
"52440","アマンデー （アマンデー） 登録済み 解除する 行きたい","","","https://www.kagoshima-kankou.com/guide/52440/","","0997-63-1111（奄美市笠利総合支所産業振興課）","鹿児島県奄美市笠利町平","","","","［車］ ・奄美市笠利総合支所から約15分","有り（駐車スペース）","https://www.amami-tourism.org/"
"52851","高崎山 （コウサキヤマ） 登録済み 解除する 行きたい","","","https://www.kagoshima-kankou.com/guide/52851/","","0993-53-2111（南さつま市役所）","鹿児島県南さつま市笠沙町片浦","","","","・指宿スカイライン「谷山ＩＣ」から車で約1時間 ・「高崎山（こうさきやま）」バス停下車徒歩約15分","有","http://www.city.minamisatsuma.lg.jp/kanko/kaidou/introduction.html"
"10108","鹿児島県立霧島自然ふれあいセンター （カゴシマケンリツキリシマシゼンフレアイセンター） 登録済み 解除する 行きたい","","","https://www.kagoshima-kankou.com/guide/10108/","","0995-78-2815","鹿児島県霧島市牧園町高千穂3617-1","※公式サイトをご覧ください","※公式サイトをご覧ください","※公式サイトをご覧ください","［車］ ・ＪＲ霧島温泉駅から約15分（バスで約20分） ・鹿児島空港より約25分（バスで約30分）","有","https://ki-fureaicenter.jp/"
"10130","日当山温泉公園 （ヒナタヤマオンセンコウエン） 登録済み 解除する 行きたい","","","https://www.kagoshima-kankou.com/guide/10130/","","0995-45-5111（霧島市建設施設管理課）","鹿児島県霧島市隼人町東郷","","","無料","［車］ ・九州自動車道「溝辺鹿児島空港ＩＣ」より約15分（6.8km） ・ＪＲ日豊本線隼人駅より約10分（4.1km） ・東九州自動車道「隼人西ＩＣ」より約20分（7.8km） ・ＪＲ肥薩線日当山駅から徒歩約10分（850m）","有","https://www.city-kirishima.jp/ken-cho/kurashi/koen/hayato/hinatayamaonsen.html"
"70963","三連轟 （さんれんとどろ） 登録済み 解除する 行きたい","","","https://www.kagoshima-kankou.com/guide/70963/","","0986-76-8282（商工観光課）","〒899-4103 鹿児島県曽於市財部町6109","","無休","無料","大隅大川原駅から車で約10分","あり",""
"70550","【2026】おれんじオルレ2026 （おれんじおるれ2026） 登録済み 解除する 行きたい","","","https://www.kagoshima-kankou.com/guide/70550/","","0996-63-4777（九州オルレ出水コース運営実行委員会（出水市観光交流課））","〒899-0341 鹿児島県出水市上大川内3851","受付時間：09:00～9:45 受付後10:00スタート予定","","1,500円／人 ※軽食代及び保険料含む ※定員230名（先着）","受付場所：厳島神社 ※当日は、出水駅西口バス１番乗り場から厳島神社（スタート地点）までと、 出水麓歴史館（ゴール地点）から出水駅西口バス１番乗り場までの臨時無料バスを運行します。 ★臨時無料バス（往路） 出発場所：出水駅西口バス１番乗り場 出発時刻：(1) 08:30 (2) 09:10 （予定） ★臨時無料バス（復路） 出発場所：出水麓歴史館 運行時間：随時運行","出水駅周辺の駐車場（有料） 出水駅東口前臨時駐車場（無料）","https://shinsei.pref.kagoshima.jp/SksJuminWeb/EntryForm?id=EzUSIqWV"
"70868","フォレストアドベンチャー・吹上浜 （フォレストアドベンチャー・フキアゲハマ） 登録済み 解除する 行きたい","","","https://www.kagoshima-kankou.com/guide/70868/","","080-2112-1154","鹿児島県日置市吹上町中原1352-34","9：00～17：00","公式サイトの営業日カレンダーをご確認ください","公式サイトをご確認ください","【車でお越しの方】 鹿児島空港より約1時間 鹿児島市内中心部より約45分 九州自動車道 鹿児島ICより約30分 指宿スカイライン 谷山ICより約25分 南九州西回り自動車道 伊集院ICより約25分 日置市街地(伊集院駅)より約25分 【公共交通機関でお越しの方】 ・JR鹿児島本線『伊集院駅』から40分（バス32分+徒歩8分） ※伊集院駅前の鹿児島交通『伊集院』バス停より、『加世田・枕崎 ゆき』に乗車 ⇒『吹上浜(旧駅)』バス停にて下車。","無料駐車場(300 台、大型車も可）","https://foret-aventure.jp/park/fa-fukiagehama/"
"10185","タエン浜海水浴場 （タエンハマカイスイヨクジョウ） 登録済み 解除する 行きたい","","","https://www.kagoshima-kankou.com/guide/10185/","","0997-67-2211（宇検村役場経済課）","鹿児島県大島郡宇検村平田3631","10：00～17；00","","無料","［車］ ・奄美空港から奄美市名瀬・住用町経由で、宇検村まで約1時間40分。宇検村役場から屋鈍方面へ約25分。","有","https://www.amami-tourism.org/scenic-spots/%e3%82%bf%e3%82%a8%e3%83%b3%e6%b5%9c%e6%b5%b7%e6%b0%b4%e6%b5%b4%e5%a0%b4/"
"10833","南薩鉄道記念館 （なんさつてつどうきねんかん） 登録済み 解除する 行きたい","","","https://www.kagoshima-kankou.com/guide/10833/","","0993-53-2102","鹿児島県南さつま市加世田本町10","10:00～17:00","","大人（中学生以上） 200円 小人（小学生以下） 100円","バス： 鹿児島中央駅から約1時間半 「加世田」下車","","https://kanko-minamisatsuma.jp/spot/11952/"
"10309","大金久（オオガネク）海岸・キャンプ場 （おおかねぐかいがん・きゃんぷじょう） 登録済み 解除する 行きたい","","","https://www.kagoshima-kankou.com/guide/10309/","","0997-97-5151（ヨロン島観光協会／キャンプ場は与論町商工観光課 0997-97-4902）","鹿児島県大島郡与論町古里","","","詳細はお問い合わせください","［車］ ・与論空港、与論港（フェリー乗り場）から約20分","有","https://www.yorontou.info/spot/5179.html"
"11355","島津久光公像 （しまづひさみつこうぞう） 登録済み 解除する 行きたい","","","https://www.kagoshima-kankou.com/guide/11355/","","","〒892-0841 鹿児島県鹿児島市照国町","","","","・市電「天文館」から徒歩約5分 ・カゴシマシティビュー「西郷銅像前」下車徒歩約3分","","https://www.kagoshima-yokanavi.jp/transportation/10409"
"10305","ユンヌ楽園 （ユンヌラクエン） 登録済み 解除する 行きたい","","","https://www.kagoshima-kankou.com/guide/10305/","","0997-97-2341","鹿児島県大島郡与論町茶花1393","9：00～17：00","","","［車］ ・与論港（フェリー乗り場）、与論空港より約10分","","https://www.yorontou.info/spot/5170.html"
"10308","与論民俗村 （ヨロンミンゾクムラ） 登録済み 解除する 行きたい","","","https://www.kagoshima-kankou.com/guide/10308/","","0997-97-2934","鹿児島県大島郡与論町東区693","9：00～18：00","年中無休","［入場見学料］ 大人（中学生以上）：500円 小学生：300円 ※団体割引あり ※体験は別料金で、コースによって異なります。詳細は公式サイトにてご確認ください。","［車］ ・与論港、与論空港より約15分","有","https://yoronminzokumura.com/"
"53142","モッチョム岳 （モッチョムダケ） 登録済み 解除する 行きたい","","","https://www.kagoshima-kankou.com/guide/53142/","","0997-43-5900（屋久島町役場観光まちづくり課）","鹿児島県熊毛郡屋久島町尾之間","","","無料","〇千尋の滝展望台モッチョム岳登山口まで ［車］ ・宮之浦から約50分 ・安房から約20分 ［バス］ ・「鯛之川」バス停下車、徒歩約60分","有（千尋の滝駐車場を利用）","http://www.town.yakushima.kagoshima.jp/cust-facility/1585/"
"70371","串木野麓 （くしきのふもと） 登録済み 解除する 行きたい","","","https://www.kagoshima-kankou.com/guide/70371/","","0996-32-5256（いちき串木野市総合観光案内所）","〒896-0052 鹿児島県いちき串木野市上名","","","","[車] ・鹿児島空港から約70分 ・鹿児島中央駅から約35分 ・東九州自動車道串木野ICから約1分 ・JR串木野駅から約5分","あり","https://kagoshima-fumoto.jp/ichikikushikino/"
"60013","市来えびす市場 （いちきえびすいちば） 登録済み 解除する 行きたい","","","https://www.kagoshima-kankou.com/guide/60013/","","0996-21-5082","〒899-2101 鹿児島県いちき串木野市湊町1-99","[えびす市場] 9：00～17：30 [えびす食堂] 11：00～15：00 ※ラストオーダーは14：30","[えびす市場] 毎月第2・4水曜日 ※12月は第2水曜日のみ 年末年始(12月31日～1月4日) [えびす食堂] 毎週水曜日 年末年始(12月31日～1月4日)","","[車］鹿児島中央駅から約35分、東九州自動車道市来ICから約6分","あり","http://www.ichikiebisuichiba.jp/"
"52509","りゅうがく館（西郷松） （リュウガクカン） 登録済み 解除する 行きたい","","","https://www.kagoshima-kankou.com/guide/52509/","","0997-62-3110（りゅうがく館代表）","鹿児島県大島郡龍郷町瀬留968-1","9：00～22：00（日曜日は9：00～17：00） ※島ミュージアム（文化財展示室）は月～土も17：00まで ※祝日も、上記の通りに開館","年末年始 ※その他、台風や停電などにより臨時休館となる場合があります","無料","［車］ ・奄美空港から約20分 ・名瀬市中心地より約30分","有り","https://www.amami-tourism.org/"
"53591","坊津B&G海洋センター （ボウノツビーアンドジーカイヨウセンター） 登録済み 解除する 行きたい","","","https://www.kagoshima-kankou.com/guide/53591/","","0993-67-0170","鹿児島県南さつま市坊津町久志807-1","9：00〜16：30 ※悪天候の場合休館します","7月20日～8月31日：月曜日または祝日の翌日 9月1日～9月26日：月曜日～金曜日（土日のみ開館）","※詳細は公式サイトにてご確認ください","［車］ 国道226号線丸木浜停留所から左折し、約5分","有","https://kanko-minamisatsuma.jp/spot/11651/"
"51457","竜石 （タツイシ） 登録済み 解除する 行きたい","","","https://www.kagoshima-kankou.com/guide/51457/","","0996-25-4700（薩摩川内市観光物産協会 ）","鹿児島県薩摩川内市祁答院町藺牟田","","","","","",""
"13110","園林寺跡（小松家墓地） （オンリンジアト（コマツケボチ）） 登録済み 解除する 行きたい","","","https://www.kagoshima-kankou.com/guide/13110/","","099-273-2111（日置市役所）","鹿児島県日置市日吉町吉利5004-3","","","","・鹿児島市内から車で約40分（鹿児島ＩＣ～伊集院ＩＣ利用の場合） ・JR伊集院駅から車で約20分","なし","https://www.city.hioki.kagoshima.jp/bunkazai/kurashi/kosodate-kyoiku/shakaikyoiku/bunkazai/hiyoshi/onrinjiato.html"
"51181","諏訪神社 （スワジンジャ） 登録済み 解除する 行きたい","","","https://www.kagoshima-kankou.com/guide/51181/","","0996-63-3340","鹿児島県出水市麓町13-38","","無休","無料","ＪＲ出水駅から車で約5分、徒歩約20分","有 （※出水麓武家屋敷群内の観光用駐車場を御利用ください）","https://www.izumi-navi.jp/spots/post-1074/"
"51279","徳浜海岸 （トクハマカイガン） 登録済み 解除する 行きたい","","","https://www.kagoshima-kankou.com/guide/51279/","","0997-72-1199（奄美せとうち観光協会）","鹿児島県大島郡瀬戸内町諸鈍徳浜","","","無料","［車］ ・古仁屋から瀬相港もしくは生間港へフェリーで約20分、瀬相港からは約45分、生間港からは約10分","有り（指定区域に駐車する必要あり）","https://www.setouchi-welcome.com/spotinfo/%E5%BE%B3%E6%B5%9C%E3%83%93%E3%83%BC%E3%83%81"
"10331","鹿屋市民族館（アジア太平洋農村研修村民族館） （カノヤシミンゾクカン） 登録済み 解除する 行きたい","","","https://www.kagoshima-kankou.com/guide/10331/","","0994-45-2872","鹿児島県鹿屋市上高隈町3779-1","9：00～17：00","月曜日 ※祝日の場合は開館、祝日明けの平日を休館 年末年始","無料","［車］ ・鹿屋市役所から約30分","有","https://minzokukan.jimdosite.com/"
"70714","村山陶芸 （むらやまとうげい） 登録済み 解除する 行きたい","","","https://www.kagoshima-kankou.com/guide/70714/","","099-293-2322","〒891-1420 鹿児島県桜島赤水町1080","9:00-17:00 体験受付時間 9:00〜16:00","不定休","","・桜島フェリーターミナルからサクラジマアイランドビュー「赤水湯之平口」下車徒歩約2分 ・桜島フェリーターミナルから車で約8分","あり","https://www.jalan.net/kankou/spt_guide000000216558/"
"11103","手広（テビロ）海岸 （テビロカイガン） 登録済み 解除する 行きたい","","","https://www.kagoshima-kankou.com/guide/11103/","","0997-62-3111（龍郷町企画観光課）","鹿児島県大島郡龍郷町赤尾木1687","","","無料","［車］ ・奄美空港より約15分","","https://www.town.tatsugo.lg.jp/kikakukanko/kanko/surfing.html"
"10188","屋鈍（ヤドン）海水浴場 （ヤドンカイスイヨクジョウ） 登録済み 解除する 行きたい","","","https://www.kagoshima-kankou.com/guide/10188/","","0997-67-2211（宇検村役場）","鹿児島県大島郡宇検村屋鈍","","","","［車］ ・奄美空港から奄美市名瀬・住用町経由で、宇検村まで約1時間40分。宇検村役場から屋鈍まで約30分。","有","https://www.amami-tourism.org/scenic-spots/%e5%b1%8b%e9%88%8d%e6%b5%b7%e5%b2%b8/"
"30903","名湯 歴史の館 中島温泉旅館 （メイトウ レキシノヤカタ ナカシマオンセンリョカン） 登録済み 解除する 行きたい","","","https://www.kagoshima-kankou.com/guide/30903/","","099-296-2073","鹿児島県日置市吹上町湯之浦1106","","","","［車］ ・鹿児島空港から約60分（高速道路利用） ・ＪＲ鹿児島中央駅から約60分","有","http://www.nakashima-onsen.com/"
"51261","屋久島里めぐり （ヤクシマサトメグリ） 登録済み 解除する 行きたい","","","https://www.kagoshima-kankou.com/guide/51261/","","0997-42-2900（屋久島里めぐり推進協議会(屋久島環境文化村センター内)）","鹿児島県熊毛郡屋久島町宮之浦823-1","","","1,500円～(コースによって異なります)","集合場所が集落により異なりますので、詳細はお問い合わせください","","http://www.yakushima.jp/"
"10419","薩摩川内市川内歴史資料館 （サツマセンダイシセンダイレキシシリョウカン） 登録済み 解除する 行きたい","","","https://www.kagoshima-kankou.com/guide/10419/","","0996-20-2344（川内歴史資料館）","鹿児島県薩摩川内市中郷2丁目2-6","9：00 ～ 17：00（入館は16：30まで）","・月曜(祝日の場合は翌日以降の休日でない日) ・教育委員会が定める臨時の休館日 ・12月29日～1月3日","［入館料］ 大人：200円 小・中・高校生：100円 ※未就学児は無料 ※土日祝は、小・中・高校生は入館料無料 ※団体割引等あり、詳細は公式サイトにてご確認ください","［車］ ・川内駅から約7分 ［バス］ ・くるくるバスをご利用の場合は、「歴史資料館前」で下車","有","http://rekishi.satsumasendai.jp/"
"70102","芦花部の南洲神社 （アシケブノナンシュウジンジャ） 登録済み 解除する 行きたい","","","https://www.kagoshima-kankou.com/guide/70102/","","","鹿児島県鹿児島県奄美市名瀬大字芦花部1233","","","","","",""
"51631","桜島海軍基地跡 （さくらじまかいぐんきちあと） 登録済み 解除する 行きたい","","","https://www.kagoshima-kankou.com/guide/51631/","","","〒891-1419 鹿児島県鹿児島市桜島横山町","","","","桜島港桜島フェリーターミナルから徒歩約5分","","https://www.kagoshima-yokanavi.jp/article/sakurajima"
"51324","森林セラピーロード （シンリンセラピーロード） 登録済み 解除する 行きたい","","","https://www.kagoshima-kankou.com/guide/51324/","","0995-45-5111（霧島市観光PR課）","鹿児島県霧島市","","","無料","","","https://www.city-kirishima.jp/kirikan/kanko/shizen/shinrintherapy.html"
"70317","名山堀（路地裏のレストラン） （めいざんぼり（うらろじのれすとらん）） 登録済み 解除する 行きたい","","","https://www.kagoshima-kankou.com/guide/70317/","","","〒892-0821 鹿児島県鹿児島市名山町","","","","市電「朝日通」「市役所前」から徒歩約5分","","https://www.kagoshima-kankou.com/feature/retrip-meizanbori"
"51796","鹿児島まち歩き観光ステーション （かごしままちあるきかんこうすてーしょん） 登録済み 解除する 行きたい","","","https://www.kagoshima-kankou.com/guide/51796/","","099-208-4701","〒892-0853 鹿児島県鹿児島市城山町2-30 二之丸ビル1F","9:00～17:30","12月29日～1月3日","入場無料","・市電「朝日通」から徒歩約8分 ・カゴシマシティビュー「西郷銅像前」下車徒歩約1分 ・中央公園の地下駐車場「セラ602」徒歩約１分","隣接する中央公園の地下駐車場（セラ602：鹿児島市山下町4-1）：駐車券提示の方にサービス券をお渡し （ぶらりまち歩き参加者（2時間無料）、当該ステーション利用者（30分無料））","https://www.kagoshima-yokanavi.jp/machiaruki"
"10243","スリ浜海岸 （スリハマカイガン） 登録済み 解除する 行きたい","","","https://www.kagoshima-kankou.com/guide/10243/","","0997-72-1199（奄美せとうち観光協会）","鹿児島県大島郡瀬戸内町諸数","","","","［フェリー・バス］ ・古仁屋から生間へフェリーで約20分。生間から加計呂麻バス瀬相行きで約7分。スリ浜下車すぐ。 ［車］ ・生間から約7分","なし","https://www.setouchi-welcome.com/spotinfo/%E3%82%B9%E3%83%AA%E6%B5%9C%E3%83%93%E3%83%BC%E3%83%81"
"70584","観音渕中世供養塔群 （かんのんぶちちゅうせいくようとうぐん） 登録済み 解除する 行きたい","","","https://www.kagoshima-kankou.com/guide/70584/","","0994-31-1121（鹿屋市農林商工部ふるさとPR課観光PR係）","〒893-0132 鹿児島県鹿屋市下高隈町","","","","鹿児島空港から約１時間20分 鹿屋市から約1時間30分 垂水港から約45分","有","https://www.city.kanoya.lg.jp/kankou/bunka/kanko/kanko/10.html"
"10070","舞鶴城跡 （マイヅルジョウアト） 登録済み 解除する 行きたい","","","https://www.kagoshima-kankou.com/guide/10070/","","0995-45-5111（霧島市観光PR課）","鹿児島県霧島市国分中央二丁目5-1（国分小学校前）","","無休","","・ＪＲ国分駅より徒歩で約15分 ・鹿児島空港より車で約25分","有",""
