id,name,category,area,url,description,phone,address,hours,closed,fee,access,parking,website
"10038","たかのやま公園・キャンプ場（高野山公園） （タカノヤマコウエン・キャンプジョウ） 登録済み 解除する 行きたい","","","https://www.kagoshima-kankou.com/guide/10038/","","0996-82-0543（JPT・Tours・Japan株式会社）","鹿児島県出水市高尾野町大久保5008-17","9：00～18：00（電話問い合わせ対応時間）","定休日なし","・バンガロー（５人利用可） 1棟1泊3,130円 ・フリーサイト（車乗り入れ不可）（4名まで） 1張り1泊1,650円 ・オートキャンプ場（車乗り入れ可）（4名まで） 1区画1泊1,030円 ※詳しくは公式サイトをご覧ください","［車］ ・鹿児島市から約2時間 ・鹿児島空港から約1時間30分 ・肥薩おれんじ鉄道・高尾野駅から約5分 ［バス］ ・南国交通バス高尾野駅前バス停下車、徒歩約20分","有","https://www.nap-camp.com/kagoshima/11462"
"70805","永野鉄道記念館の桜並木 （ながのてつどうきねんかんのさくらなみき） 登録済み 解除する 行きたい","","","https://www.kagoshima-kankou.com/guide/70805/","","0996-24-8950（さつまPR課）","鹿児島県さつま町永野884","","","","［車］ ・鹿児島空港から約35分 ・鹿児島中央駅から約1時間15分 ・薩摩川内市、出水市から約55分","普通車50台（無料）","https://www.satsuma-net.jp/soshiki/yakuba/1002/3/koho_kocho/machi_hot_news/r2nendo/958.html"
"10492","手打海岸 （テウチカイガン） 登録済み 解除する 行きたい","","","https://www.kagoshima-kankou.com/guide/10492/","","09969-5-1800（下甑島観光案内所）","鹿児島県薩摩川内市下甑町手打","","","","［車］ ・手打港から約5分 ・長浜港から約20分 ・鹿島港から約40分","","https://satsumasendai.gr.jp/spotlist/1729/"
"51991","月屋山 / 川内川あらし （ツキヤサン / センダイガワアラシ） 登録済み 解除する 行きたい","","","https://www.kagoshima-kankou.com/guide/51991/","","0996-26-3849（世界自然遺産を目指す川内川あらし協議会（水引地区コミュニティ協議会内））","鹿児島県薩摩川内市湯島町","","","","［車］ ・ＪＲ川内駅から約25分","有","https://www.sendaigawaarashi.com/"
"53106","蒲生カントリークラブ （カモウカントリークラブ） 登録済み 解除する 行きたい","","","https://www.kagoshima-kankou.com/guide/53106/","","0995-52-0381","鹿児島県姶良市蒲生町米丸2448","7：00～18：00","","詳細は公式サイトにてご確認ください","［車］ ・鹿児島空港から約45分 ・鹿児島中央駅から約55分","有","http://www.kamou-cc.jp/"
"10363","湯治湯の郷 湯の谷温泉 （ユノタニオンセン） 登録済み 解除する 行きたい","","","https://www.kagoshima-kankou.com/guide/10363/","","0994-34-6161（湯治湯の郷 湯の谷温泉）","鹿児島県肝属郡肝付町岸良1603-20","","","","","","https://kankou-kimotsuki.net/archives/introduce/yunotani-onsen"
"52830","谷山神社 （タニヤマジンジャ） 登録済み 解除する 行きたい","","","https://www.kagoshima-kankou.com/guide/52830/","","","鹿児島県鹿児島市下福元町3786-3","","","","・ＪＲ「慈眼寺駅」から車で約5分 ・「慈眼寺公園」バス停下車徒歩15分 ・ＪＲ「慈眼寺駅」から徒歩20分","有",""
"52808","川辺峠 （カワナベトウゲ） 登録済み 解除する 行きたい","","","https://www.kagoshima-kankou.com/guide/52808/","","","鹿児島県鹿児島市平川町6069","","","無料","指宿スカイライン川辺ICから車で約5分","あり",""
"10405","鹿児島県照葉樹の森・稲尾岳ビジターセンター （カゴシマケンショウヨウジュノモリ イナオダケビジターセンター） 登録済み 解除する 行きたい","","","https://www.kagoshima-kankou.com/guide/10405/","","080-6417-6518（稲尾岳ビジターセンター）","鹿児島県肝属郡錦江町田代麓久木野5166-647","8：30～17：00","12月29日～31日","［入館料］ ・無料 ※各種体験料金につきましては公式サイトにてご確認ください","［車］ ・桜島港から約120分 ・垂水港から約90分 ・南大隅町（旧根占町）から約40分","有","https://www.kanoya-ryokka.com/shouyouju/index.html"
"60145","江口蓬莱館 （えぐちほうらいかん） 登録済み 解除する 行きたい","","","https://www.kagoshima-kankou.com/guide/60145/","","099-274-7666","〒899-2203 鹿児島県日置市東市来町伊作田7425-5","物産館 9：00～17：30 レストラン 11：00～15：00","火曜日（祝日の場合は営業）","","●JR鹿児島中央駅より自動車で約30分 鹿児島空港より自動車で約60分 ●南九州自動車道をご利用の場合 福岡・熊本方面からは｢市来IC｣より約8分 鹿児島市街方面からは｢美山IC｣より約7分 ●国道270号線沿い、江口浜海浜公園の南側にあります","有","https://eguchihouraikan.jp/"
"10259","国直海岸 （くになおかいがん） 登録済み 解除する 行きたい","","","https://www.kagoshima-kankou.com/guide/10259/","","0997-57-2117（大和村企画観光課）","〒894-3101 鹿児島県大島郡大和村大字国直","","","","［車］ ・奄美空港から約1時間20分 ・奄美市名瀬から約25分","有り","https://www.vill.yamato.lg.jp/kikaku/shisetsu/kanko-spot/001.html"
"70567","桜島国際火山砂防センター （さくらじまこくさいかざんさぼうせんたー） 登録済み 解除する 行きたい","","","https://www.kagoshima-kankou.com/guide/70567/","","099-221-2030（099-221-2030）","〒891-1541 鹿児島県鹿児島市野尻町203-1","9：30～17：00（最終受付16：30まで）","定休日なし ※12月29日～1月3日は休館（その他臨時休館の場合があります。）","入館無料","［車］桜島港から約6分 ［バス］サクラジマアイランドビュー（循環バス）Bコース乗車後「国際火山砂防センター」下車（※Aコースは停まりません）","20台","https://www.qsr.mlit.go.jp/osumi/contents/jigyo/sand/prevention/establishment.html"
"10702","玉乃井 （たまのい） 登録済み 解除する 行きたい","","","https://www.kagoshima-kankou.com/guide/10702/","","0993-22-2111（指宿市観光課）","鹿児島県指宿市開聞十町","","","","・車で指宿方面から国道226号線を西に走り、開門十町交差点を右折し約3分 ・JR開聞駅から 徒歩約15分","なし","https://www.ibusuki.or.jp/tourism/view/tamanoi/"
"10943","郡山八幡神社（焼酎落書） （こおりやまはちまんじんじゃ（しょうちゅうらくしょ）） 登録済み 解除する 行きたい","","","https://www.kagoshima-kankou.com/guide/10943/","","0995-23-1311（伊佐市教育委員会）","〒895-2507 鹿児島県伊佐市大口大田郡山1549","","無休","","・大口市街地中心の大口ふれあいセンターから国道268号を水俣方面へ向い、車で約8分。 ・大口バスセンターからバス15分","10台","https://www.city.isa.kagoshima.jp/"
"11414","西郷南洲記念館 （さいごうなんしゅうきねんかん） 登録済み 解除する 行きたい","","","https://www.kagoshima-kankou.com/guide/11414/","","0997-92-0999（西郷南洲記念館）","鹿児島県大島郡和泊町和泊587-3","9：00～17：00","月曜日","高校生以上 200円 小中学生 100円 ※団体割引等あり ※詳しくは公式サイトにてご確認ください","［車］ ・沖永良部空港から約20分 ・和泊港から約5分","有","https://okinoerabujima.info/spot/1004"
"10393","浜尻海岸・キャンプ場 （ハマシリカイガン・キャンプジョウ） 登録済み 解除する 行きたい","","","https://www.kagoshima-kankou.com/guide/10393/","","0994-24-3115（南大隅町企画観光課）","鹿児島県肝属郡南大隅町佐多浜尻","","無休","無料","垂水港から車で約80分、鹿屋市街から約70分、根占港から約30分で佐多着。これより浜尻ヘ約15分。","一般車：20台","https://www.town.minamiosumi.lg.jp/kanko/leisure/leisure/camp.html"
"11379","島津義弘公銅像 （シマヅヨシヒロコウドウゾウ） 登録済み 解除する 行きたい","","","https://www.kagoshima-kankou.com/guide/11379/","","099-273-2111（日置市商工観光課）","鹿児島県日置市伊集院町駅前","","","","ＪＲ伊集院駅前","","http://www.kagoshima-kankou.com/guide/10797/"
"13192","垂水千本イチョウ （タルミズセンボンイチョウ） 登録済み 解除する 行きたい","","","https://www.kagoshima-kankou.com/guide/13192/","","0994-32-1111（垂水市水産商工観光課）","〒891-2111 鹿児島県垂水市新御堂","","","","・垂水港から車で約12分（約6.9km） ・垂水市役所前の県道71号線を東へ、車で約10分（約4.7km）","有（身障者用2台含） ※シーズン中は臨時駐車場を開設","https://www.city.tarumizu.lg.jp/kanko/koi/miryoku/meisho/senbon.html"
"70280","ふるさと考古歴史館 （ふるさとこうこれきしかん） 登録済み 解除する 行きたい","","","https://www.kagoshima-kankou.com/guide/70280/","","099-266-0696","〒891-0144 鹿児島県鹿児島市下福元町3763-1","9:00～17:00","月曜日（祝日の場合は翌平日）、12月29日～1月1日","一般 450円、 小学生・中学生 220円","・鹿児島中央駅からJRで約15分「慈眼寺駅」下車徒歩約20分","あり","https://www.k-kb.or.jp/koukokan/"
"10924","鶴田ダム公園 （ツルタダムコウエン） 登録済み 解除する 行きたい","","","https://www.kagoshima-kankou.com/guide/10924/","","0996-59-2030（鶴田ダム管理所）","鹿児島県薩摩郡さつま町神子3988-2","ダム見学に関しての詳細は公式サイトをご覧ください","川内川大鶴ゆうゆう館：火曜定休","ダム見学料：1,000円 ※高校生以下は無料（大人同伴）","［車］ ・さつま町役場から約30分 ・横川ＩＣから約45分","有","http://www.qsr.mlit.go.jp/turuta/"
"10324","世之主の墓 （よのぬしのはか） 登録済み 解除する 行きたい","","","https://www.kagoshima-kankou.com/guide/10324/","","0997-92-1111（和泊町企画課）","鹿児島県大島郡和泊町内城","","","無料","［飛行機・車］ ・鹿児島空港からJACで沖永良部空港まで約1時間15分、沖永良部空港から車で約35分 ［フェリー・車］ ・鹿児島新港からフェリーで和泊港まで約18時間、和泊港から車で約10分","無","https://okinoerabujima.info/spot/1012"
"10253","嘉徳（カトク）海岸 （カトクカイガン） 登録済み 解除する 行きたい","","","https://www.kagoshima-kankou.com/guide/10253/","","0997-72-1111（瀬戸内町役場）","鹿児島県大島郡瀬戸内町嘉徳","","","無料","［車］ ・奄美市役所から約1時間 ・奄美空港から約1時間40分","有","http://www.town.setouchi.lg.jp/index.html"
"53322","旅館玉之湯 （リョカンタマノユ） 登録済み 解除する 行きたい","","","https://www.kagoshima-kankou.com/guide/53322/","","0996-55-9111","鹿児島県薩摩郡さつま町湯田1366-42","","","","［車］ ・横川ＩＣから約30分 ・鹿児島空港から約40分","有","https://www.tamanoyu.jp/"
"53110","さつまリゾートホテル （サツマリゾートホテル） 登録済み 解除する 行きたい","","","https://www.kagoshima-kankou.com/guide/53110/","","0996-57-1511","鹿児島県薩摩郡さつま町求名6122","テニスナイターは22:00まで","","","・鹿児島空港から車で約45分 ・九州自動車道横川ⅠＣから車で約30分","有","https://www.satsuma-golf.com/"
"53398","甑島断崖クルーズ （コシキシマダンガイクルーズ） 登録済み 解除する 行きたい","","","https://www.kagoshima-kankou.com/guide/53398/","","09969-2-1150（観光船かのこ）","〒896-1201 鹿児島県薩摩川内市上甑町中甑383-3","8:30～17:00","年末年始、定期メンテナンスによる運休日、海がしけのとき","・遊覧鹿島断崖コース、遊覧東海岸コース（荒天時）：大人 2,500円、小人 1,300円 ・遊覧西海岸コース（臨時便・10名以上予約制）：大人3,500円、小人1,800円 ※事前予約割引など、各種割引制度あり ※障がい者の料金は、障がい者手帳の提示により半額免除（1級～4級の身体障害者手帳及び療育手帳の交付を受けている者の介護者1人も半額免除）","・九州新幹線「川内駅」から「串木野新港行」のバス約35分、「串木野新港」～フェリー約1時間15分「里港」～バス約15分「中甑港」下車 ・九州新幹線「川内駅」から「川内港ターミナル行」のバス約30分、「川内港」～高速船約50分「里港」～バス約15分「中甑港」下車","あり","https://twitter.com/kanoko_info"
"10981","メセナ住吉交流センター（メセナ温泉） （メセナスミヨシコウリュウセンター（メセナオンセン）） 登録済み 解除する 行きたい","","","https://www.kagoshima-kankou.com/guide/10981/","","0986-76-7898","鹿児島県曽於市末吉町二之方2971-1","7：00～22：00","毎月第1、3月曜日(祝日の場合は翌日)","","［車］ ・曽於市本庁、末吉支所から県道503号線を松山方面へ約8分","有","http://mecena-sueyoshi.com/onsen-mecena/"
"50365","旅籠 しび荘 （シビソウ） 登録済み 解除する 行きたい","","","https://www.kagoshima-kankou.com/guide/50365/","","0996-59-8001","鹿児島県薩摩郡さつま町紫尾2168","［立ち寄り湯］8：00～21：00","年中無休","［立ち寄り湯］大人300円、小学生以下100円","［車］ ・九州自動車道横川ＩＣから約45分","有","http://shibisou.jp/"
"10569","桜島ビジターセンター （さくらじまびじたーせんたー） 登録済み 解除する 行きたい","","","https://www.kagoshima-kankou.com/guide/10569/","","099-293-2443","〒891-1419 鹿児島県鹿児島市桜島横山町1722-29","9:00～17:00","無休","","・桜島フェリーターミナル桜島港から徒歩約10分 ・桜島港フェリーターミナルからサクラジマアイランドビュー「ビジターセンター」下車","普通車あり","https://www.kagoshima-yokanavi.jp/article/sakurajima"
"10144","さえずりの森（キャンプ場）・高倉展望台 （サエズリノモリ（キャンプジョウ）・タカクラテンボウダイ） 登録済み 解除する 行きたい","","","https://www.kagoshima-kankou.com/guide/10144/","","0995-62-6666（さえずりの森管理センター）","鹿児島県姶良市加治木町西別府3490","チェックイン：16：00 チェックアウト：翌10：00","月曜日（7・8月は毎日営業）","※公式サイトをご覧ください","［車］ ・鹿児島空港から約20分 ・九州自動車道「加治木ＩＣ」から約5分 ・ＪＲ「加治木駅」から約10分","有","https://www.city.aira.lg.jp/rinsui/gyosei/shisetsu/kanko/saezuri/index.html"
"10274","ウジジ浜 （うじじはま） 登録済み 解除する 行きたい","","","https://www.kagoshima-kankou.com/guide/10274/","","0997-84-3162（知名町企画振興課）","鹿児島県大島郡知名町芦清良（あしきょら）","","","","［飛行機・車］ ・鹿児島空港からJACで沖永良部空港まで約1時間40分、沖永良部空港から車で約40分","有","https://okinoerabujima.info/spot/1015"
"50100","高城庵 （タキアン） 登録済み 解除する 行きたい","","","https://www.kagoshima-kankou.com/guide/50100/","","0993-83-3186（高城庵）","〒897-0302 鹿児島県南九州市知覧町郡6329","11:00～15:00（14:30LO）","不定休","","","知覧武家屋敷庭園群近くの駐車場を御利用下さい。","http://takian.jp/"
"10581","千貫平自然公園 （センガンビラシゼンコウエン） 登録済み 解除する 行きたい","","","https://www.kagoshima-kankou.com/guide/10581/","","099-216-1327（鹿児島市観光振興課）","鹿児島県鹿児島市喜入生見町指宿スカイライン（県道17号）沿い","","無休","","［車］ ・鹿児島市市街地から約1時間15分","有","https://www.city.kagoshima.lg.jp/kanshin/shisetsu/kanko/032.html"
"53537","小松食堂 （コマツショクドウ） 登録済み 解除する 行きたい","","","https://www.kagoshima-kankou.com/guide/53537/","","0994-42-2075","鹿児島県鹿屋市北田町9-5","10：30～14：00","不定休","","","有","https://komatsu-shokudou.com/"
"52953","阿久根大島公園 （アクネオオシマコウエン） 登録済み 解除する 行きたい","","","https://www.kagoshima-kankou.com/guide/52953/","","0996-73-1114（阿久根市商工観光課）","鹿児島県阿久根市波留6656","海水浴期間：終日 海水浴期間以外：8：30～17：00","無休","［渡船料金］ ・大人：1000円 ・こども：500円 ・1日往復11便（海開きシーズン） ・1日往復5便（シーズン以外） ※運行出来ない場合もございますので、事前にお問合せください","［渡船場まで］ ・肥薩おれんじ鉄道「阿久根駅」から車で約5分 ・鹿児島空港から車で約1時間30分 ・南国交通バス「晴海公園前」から徒歩約5分 ［渡船場から］ ・船で約10分","渡船場：無料駐車場あり","https://akuneoshima.com/"
"13195","与路島 （ヨロジマ） 登録済み 解除する 行きたい","","","https://www.kagoshima-kankou.com/guide/13195/","","0997-72-1199（奄美せとうち観光協会）","鹿児島県大島郡瀬戸内町与路","","","","［船］ ・海の駅から町営定期船「せとなみ」で約50分 ※詳細は公式サイトにてご確認ください","","https://yorojima.jp/"
"11210","ムシロ瀬 （ムシロゼ） 登録済み 解除する 行きたい","","","https://www.kagoshima-kankou.com/guide/11210/","","0997-85-5382（天城町商工水産観光課）","鹿児島県大島郡天城町与名間字大石クジン1-3","","","","［車］ ・徳之島子宝空港から約20分","有","http://www.tokunoshima-kanko.com/tourist_spot/mushiroze/"
"52795","多賀山公園 （タガヤマコウエン） 登録済み 解除する 行きたい","","","https://www.kagoshima-kankou.com/guide/52795/","","099-216-1366（鹿児島市公園緑化課）","鹿児島県鹿児島市清水町39","","","","［徒歩］ ・ＪＲ鹿児島駅から約15分","有","http://www.kagoshima-kankou.com/guide/11357/"
"50910","辺塚海岸 （ヘツカカイガン） 登録済み 解除する 行きたい","","","https://www.kagoshima-kankou.com/guide/50910/","","0994-67-2888（肝付町観光協会）","鹿児島県肝付町","","","","［車］ ・根占港から約1時間 ・志布志港から約1時間40分","駐車スペース有り","https://kankou-kimotsuki.net/archives/introduce/hetsuka-beach"
"53600","mojo-cafe357 （モジョ カフェ） 登録済み 解除する 行きたい","","","https://www.kagoshima-kankou.com/guide/53600/","","0993-76-8070（mojo-cafe357）","鹿児島県南さつま市加世田高橋1934","11：30～18：00（ランチ11：00～14：00）","月曜日","","［車］ ・ＪＲ鹿児島中央駅から約50分 ・鹿児島空港から約60分","有",""
"53529","蒲生城跡 （カモウジョウアト） 登録済み 解除する 行きたい","","","https://www.kagoshima-kankou.com/guide/53529/","","0995-67-6052（姶良市 観光協会）","鹿児島県姶良市蒲生町久末3459-1","","無休","無","［車］ ・鹿児島空港から約30分 ・九州自動車道加治木ＩＣから約25分","有","https://aira-kankou.jp/spot/%E5%9F%8E%E5%B1%B1%E5%85%AC%E5%9C%92/"
"53533","カフェらびゅう （カフェラビュウ） 登録済み 解除する 行きたい","","","https://www.kagoshima-kankou.com/guide/53533/","","080-2772-5644（カフェらびゅう）","鹿児島県姶良市蒲生町上久徳2324","公式サイトをご覧ください","無","公式サイトをご覧ください","［車］ ・鹿児島空港から約25分 ・九州自動車道加治木ＩＣから約20分","蒲生観光交流センター駐車場利用","https://www.tjkagoshima.com/raview/"
"10834","サンセットブリッジ （サンセットブリッジ） 登録済み 解除する 行きたい","","","https://www.kagoshima-kankou.com/guide/10834/","","0993-53-2111（南さつま市商工観光課）","鹿児島県南さつま市加世田高橋","","無休","無料","［車］ ・鹿児島空港から（九州自動車道、指宿スカイライン、県道鹿児島加世田線経由）約70分 ・鹿児島市街地より約50分 ・南さつま市街地より西へ約5キロ","有","http://www.synapse.ne.jp/~kppfuki/contents/shisetsu/sunset/sunset.html"
"53325","下ノ湯 （シモノユ） 登録済み 解除する 行きたい","","","https://www.kagoshima-kankou.com/guide/53325/","","","鹿児島県薩摩川内市祁答院町藺牟田2652-2","5：00～21：00","","","［車］ ・鹿児島市より約50分 ・鹿児島空港より約45分","有","https://satsumasendai.gr.jp/spotlist/2465/"
"70270","よかど鹿児島 （よかどかごしま） 登録済み 解除する 行きたい","","","https://www.kagoshima-kankou.com/guide/70270/","","099-239-5566","〒892-0828 鹿児島県鹿児島市金生町6番6号","【本店ビル】 10:00～19:00 (一部店舗は7:00〜20:00で営業) 【本店別館ビル】 1F : 11:00～21:00(ただし、14:00〜17:00は一部店舗休業) 2F : 11:00～20:00 詳細はよかど鹿児島ＨＰをご覧ください","1月1日および毎月第2火曜日","","市電「いづろ通」から徒歩約1分","あり","https://yocado-kagoshima.jp/"
"10289","金見崎ソテツトンネル （かなみざきそてつとんねる） 登録済み 解除する 行きたい","","","https://www.kagoshima-kankou.com/guide/10289/","","0997-83-4111（徳之島町地域営業課）","鹿児島県大島郡徳之島町金見","","","","［車］ ・徳之島子宝空港より約30分","有","http://www.tokunoshima-kanko.com/tourist_spot/kanami-sotetsu-tunnel/"
"10272","田皆岬 （たみなみさき） 登録済み 解除する 行きたい","","","https://www.kagoshima-kankou.com/guide/10272/","","0997-84-3162（知名町企画振興課）","鹿児島県大島郡知名町田皆","","","","［飛行機・車］ 鹿児島空港からJACで沖永良部空港まで約1時間40分、沖永良部空港から車で約40分 ［フェリー・車］ 鹿児島新港からフェリーで和泊港まで約18時間、和泊港から車で約30分","有","https://okinoerabujima.info/spot/1022"
"52405","鹿児島ブランドショップ （かごしまぶらんどしょっぷ） 登録済み 解除する 行きたい","","","https://www.kagoshima-kankou.com/guide/52405/","","099-225-6120","〒892-0828 鹿児島県鹿児島市金生町6-6よかど鹿児島 本店ビル２階","10:00～18:00","毎月第2火曜日、年末年始","","市電「いづろ通」から徒歩約１分","あり","http://www.k-p-a.jp/shop/"
"10339","浜田海水浴場 （はまだかいすいよくじょう） 登録済み 解除する 行きたい","","","https://www.kagoshima-kankou.com/guide/10339/","","0994-47-2333（開設期間中）","鹿児島県鹿屋市浜田町668","9：00～17：00","期間内無休","無料","・「桜島港」から車で約60分 ・「垂水港」から車で約35分 ・「根占港」から車で約30分 (指宿港⇔根占港「フェリーなんきゅう10号」（高速船）で約20分）","有",""
"10985","松山城址 （マツヤマジョウシ） 登録済み 解除する 行きたい","","","https://www.kagoshima-kankou.com/guide/10985/","","099-487-2111（志布志市役所松山支所 総務市民課）","鹿児島県志布志市松山町新橋","","","","・JR志布志駅より車で約30分 ・志布志港より車で約30分","500台",""
"12628","若潮酒造株式会社 （ワカシオシュゾウカブシキガイシャ） 登録済み 解除する 行きたい","","","https://www.kagoshima-kankou.com/guide/12628/","","099-472-1185","鹿児島県志布志市志布志町安楽215","［見学］8：30～16：00","日曜・祭日 ※土曜日は不定 ※団体のお客様は事前にご予約頂ければ対応可能です","無料","","有","http://www.wakashio.com/"
"70079","スターバックスコーヒー鹿児島仙巌園店 （スターバックスコーヒーカゴシマセンガンエンテン） 登録済み 解除する 行きたい","","","https://www.kagoshima-kankou.com/guide/70079/","","099-248-6551","鹿児島県鹿児島市吉野町9688-1","8：00～21：00","不定休","","JR仙巌園駅から徒歩２分","有","https://store.starbucks.co.jp/detail-1441/"
"10850","大当石垣群の里 （オオトウイシガキグンノサト） 登録済み 解除する 行きたい","","","https://www.kagoshima-kankou.com/guide/10850/","","0993-53-2111（南さつま市観光交流課）","鹿児島県南さつま市笠沙町大当集落","","","","鹿児島市内から谷山ＩＣ～鹿児島加世田線経由～国道226号、車で約１時間20分","",""
