id,name,category,area,url,description,phone,address,hours,closed,fee,access,parking,website
"10674","ヘルシーランド露天風呂「たまて箱温泉」 （ヘルシーランドロテンブロ「タマテバコオンセン」） 登録済み 解除する 行きたい","","","https://www.kagoshima-kankou.com/guide/10674/","","0993-35-3577（ヘルシーランド露天風呂「たまて箱温泉」）","鹿児島県指宿市山川福元3292番地","9：30～19：30 (受付終了19：00)","木曜日 （祝日の場合は翌日）","【施設使用料】 大人（中学生以上）900円 小人（小学生以下）：600円 ※3歳未満無料 【施設使用料（特別期間）】 ※特別期間については、以下の特別料金となります。 大人（中学生以上）：1,500円(※入湯税100円含む) 小人（小学生以下）：700円 ※3歳未満無料 【追加オプション】 記念タオル：300円 レンタルバスタオル：300円 ※タオル類は持込も可能です。","［車］ ・ＪＲ山川駅から約10分 ・ＪＲ指宿駅から約15分 ・九州自動車道・鹿児島ＩＣから国道226号を南下、指宿市街地を経由して約60分 ［バス］ ・鹿児島交通「たまて箱温泉」バス停下車 ※下記「バス時刻表」のリンクをご参照ください","有","https://www.ibusuki.or.jp/spa/open/tamatebako/"
"10527","天文館 （てんもんかん） 登録済み 解除する 行きたい","","","https://www.kagoshima-kankou.com/guide/10527/","","099-216-1327（鹿児島市観光振興課）","〒892-0842 鹿児島県鹿児島市東千石町","","","","市電「天文館通」下車","","https://www.kagoshima-yokanavi.jp/spot?rta%5B%5D=3&rtd=&q=&lat=&lng=&st=acs&vw=tile"
"10113","霧島神宮 （キリシマジングウ） 登録済み 解除する 行きたい","","","https://www.kagoshima-kankou.com/guide/10113/","","0995-57-0001（霧島神宮）","鹿児島県霧島市霧島田口2608-5","8：00～17：30（授与所）","無休","入場、参拝無料","［車］ ・九州自動車道「溝辺鹿児島空港ＩＣ」から約40分 ［バス］ ・鹿児島空港から「霧島神宮アクセスバス」で約1時間 ・ＪＲ日豊本線「霧島神宮」駅より、霧島いわさきホテル行きバスで約15分、「霧島神宮」下車後すぐ","有","https://kirishimajingu.or.jp/"
"11054","知覧特攻平和会館 （チラントッコウヘイワカイカン） 登録済み 解除する 行きたい","","","https://www.kagoshima-kankou.com/guide/11054/","","0993-83-2525","〒897-0302 鹿児島県南九州市知覧町郡17881","9：00～17：00（入館16：30まで）","無休","［入館料］ 大人 500円 小人（小・中学生）300円 「ミュージアム知覧」 との共通券 大人 600円 小人 400円 ※他，減免等あります。詳細は，公式ホームページを御確認下さい。","［車］ ・鹿児島空港から約1時間5分（高速道路を使用） ・鹿児島中央駅から約45分","有","http://www.chiran-tokkou.jp/index.html"
"10578","桜島 （さくらじま） 登録済み 解除する 行きたい","","","https://www.kagoshima-kankou.com/guide/10578/","","","〒891-1410 鹿児島県鹿児島市桜島横山町61-4","","","","・市街地から市電「水族館口」下車徒歩8分で鹿児島港桜島フェリーターミナルへ、鹿児島港から桜島フェリーで約15分 ・市街地から市営バス16番で「水族館前下車」徒歩約3分で鹿児島港桜島フェリーターミナルへ、鹿児島港から桜島フェリーで約15分","","https://www.kagoshima-yokanavi.jp/article/sakurajima"
"51100","雄川の滝 （おがわのたき） 登録済み 解除する 行きたい","","","https://www.kagoshima-kankou.com/guide/51100/","","0994-24-3115（南大隅町企画観光課）","鹿児島県南大隅町根占","※夜間の立入はご遠慮ください","無休 ※悪天候時や上流での雨量が多くなった場合は、危険防止の観点から遊歩道への立入を禁止いたします。突発的な降雨の際も、立入を禁止する場合もございますので、あらかじめご了承ください。","大人（中学生以上）300円、小学生150円、未就学児無料 ※令和6年7月1日から利用者負担制度を導入しました。 持続可能な形で利用者の安全、利便性及び豊かな自然環境を維持することを目的とするものです。ご来訪される皆様には、本制度の趣旨へのご理解、ご協力の程よろしくお願いいたします。詳細は南大隅町ホームページをご覧ください。","［車］ ・鹿児島空港から約1時間45分（高速道路使用） ・鹿児島中央駅から （鹿児島港⇔桜島港フェリー15分経由）約2時間 （鴨池港⇔垂水港フェリー45分経由）約2時間 （有料道路使用）約2時間10分 ・志布志港から約1時間50分 ・根占港から約10分（指宿港⇔根占港 高速船約20分、山川港⇔根占港 フェリーなんきゅう約50分）","有","https://satamisaki.com/p_category/ogawanotaki"
"10734","縄文杉 （じょうもんすぎ） 登録済み 解除する 行きたい","","","https://www.kagoshima-kankou.com/guide/10734/","","0997-43-5900（屋久島町）","鹿児島県熊毛郡屋久島町","","","","(荒川登山口まで） ［車］ ・宮之浦港から「屋久杉自然館前」まで約40分、屋久杉自然館から荒川登山口バス停まで登山バスで約40分。 ・屋久島空港から「屋久杉自然館」まで約20分、屋久杉自然館から荒川登山口バス停まで登山バスで約40分。 ※詳細なアクセスは関連リンクからご確認ください ※バスチケットは前日までに購入ください ※登山口から縄文杉までは徒歩往復約8～10時間です","［3～11月］ 屋久杉自然館前約160台 ［12～2月］ 荒川登山口約20台","http://www.town.yakushima.kagoshima.jp/pickup/60706/"
"10682","山川砂むし温泉「砂湯里」 （やまがわすなむしおんせんさゆり） 登録済み 解除する 行きたい","","","https://www.kagoshima-kankou.com/guide/10682/","","0993-35-2669","鹿児島県指宿市山川福元3339-3","8：30～17：30 （受付終了 16：30）","水曜日（荒天時は休業）","【砂むし料金】 大人 1100円 小人 600円（小学生以下） ※特別期間については、以下の特別料金となります。 大人(中学生以上) 1,500円 小人(小学生以下) 750円 ※料金は浴衣料込み ※タオル類は別料金","［車］ ・ＪＲ山川駅より約10分 ・鹿児島ＩＣ（九州自動車道）より約70分 ［バス］ ・鹿児島交通バスにて「たまて箱温泉」下車後、たまて箱温泉～砂湯里間を運行しているシャトルバスを利用。","有","https://www.instagram.com/healthyland3577/"
"10525","城山公園（展望台・自然遊歩道） （シロヤマコウエン（テンボウダイ・シゼンユウホドウ）） 登録済み 解除する 行きたい","","","https://www.kagoshima-kankou.com/guide/10525/","","099-298-5111（観光交流センター）","鹿児島県鹿児島市城山町","","","","［車］ ・九州自動車道「鹿児島北IC」から国道経由約15分 ［バス］ ・鹿児島中央駅からカゴシマシティビュー・まち巡りバスで約25分、「城山」バス停下車すぐ","有","https://www.kagoshima-yokanavi.jp/article/sakurajima"
"10526","国指定名勝 仙巌園 （くにしていめいしょう せんがんえん） 登録済み 解除する 行きたい","","","https://www.kagoshima-kankou.com/guide/10526/","","099-247-1551","〒892-0871 鹿児島県鹿児島市吉野町9700-1","9:00～17:00","3月第1日曜日(鹿児島マラソンの為休業)","【仙巌園・尚古集成館・御殿】 ○ 一般(15歳以上、中高生を除く) 1,600円 ○ 団体(20名以上) 1,400円 ○ 小中学生・高校生 800円 ○ 小中学生・高校生(修学旅行・学校行事) 700円 ○ 障がい者手帳、鹿児島市敬老パスをお持ちの方 800円","・JR仙巌園駅下車すぐ ・鹿児島中央駅からカゴシマシティビューで約50分「仙巌園前」下車 ・JR鹿児島中央駅から車で約20分","あり（有料）","https://www.kagoshima-yokanavi.jp/article/senganen"
"10942","曽木の滝公園 （ソギノタキコウエン） 登録済み 解除する 行きたい","","","https://www.kagoshima-kankou.com/guide/10942/","","0995-28-2600（曽木の滝観光案内所）","鹿児島県伊佐市大口宮人628-41","","無休","無料","［車］ ・九州自動車道「栗野ＩＣ」から約25分、「人吉ＩＣ」から約50分 ・伊佐市街地から国道267号、県道404号線経由約15分 ・九州新幹線「出水駅」から約40分、「新水俣駅」から約45分","有","https://soginotaki.kagoshima.jp/"
"10446","藤川天神（臥龍梅） （フジカワテンジン（ガリュウバイ）） 登録済み 解除する 行きたい","","","https://www.kagoshima-kankou.com/guide/10446/","","0996-42-0753（藤川天神社務所）","鹿児島県薩摩川内市東郷町藤川","","","","［車］ ・鹿児島空港から約1時間20分 ・鹿児島市から約1時間30分 ・ＪＲ川内駅から約30分 ※藤川天神や周辺までの公共交通機関はありません","有","https://satsumasendai.gr.jp/spotlist/1844"
"11761","菅原神社（荒平天神） （すがわらじんじゃ（あらひらてんじん）） 登録済み 解除する 行きたい","","","https://www.kagoshima-kankou.com/guide/11761/","","0994-31-1121（鹿屋市ふるさとPR課）","鹿児島県鹿屋市天神町4014（県道68号沿い）","","","","［車］ ・垂水フェリーターミナルから約20分","有","http://www.kagoshima-kankou.com/course/50306/"
"53112","人気ポケモン「イーブイ」と進化形のマンホール （ニンキポケモン「イーブイ」トシンカケイノマンホール） 登録済み 解除する 行きたい","","","https://www.kagoshima-kankou.com/guide/53112/","","0993-22-2111（指宿市役所観光課）","鹿児島県指宿市","","","","［車］ ・ＪＲ鹿児島中央駅から指宿市まで約90分 ・鹿児島空港から指宿市まで約90分","","https://www.ibusuki.or.jp/news/2019/02/22/28388.html"
"10387","佐多岬公園 （さたみさきこうえん） 登録済み 解除する 行きたい","","","https://www.kagoshima-kankou.com/guide/10387/","","0994-27-3151（佐多岬公園観光案内所）","鹿児島県肝属郡南大隅町佐多馬籠417","8：00～日没","無休","無料","［車］ ・鹿児島空港から約2時間30分（高速道路使用） ・鹿児島中央駅から（鹿児島港⇔桜島港フェリー15分経由）約3時間 （鴨池港⇔垂水港フェリー45分経由）約2時間50分 （高速道路使用）約2時間50分 ・志布志港から約2時間 ・根占港から約60分（指宿港⇔根占港高速船約20分、山川港⇔根占港フェリーなんきゅう約50分）","有","https://www.town.minamiosumi.lg.jp/kanko/index.html"
"10972","溝ノ口洞穴 （ミゾノクチドウケツ） 登録済み 解除する 行きたい","","","https://www.kagoshima-kankou.com/guide/10972/","","0986-76-8282（曽於市商工観光課）","鹿児島県曽於市財部町下財部4907付近（入口から奥へ約1300ｍ）","","","","［車］ ・鹿児島空港から約50分 ・霧島温泉郷から約40分 ・鹿児島中央駅から約1時間25分 ・ＪＲ財部駅から約15分 ・東九州自動車道末吉財部ＩＣから約35分","","https://www.city.soo.kagoshima.jp/kankou_event/rekisibunnka/siseki/mizonokuchidouketsu.html"
"10330","鹿屋航空基地史料館 （カノヤコウクウキチシリョウカン） 登録済み 解除する 行きたい","","","https://www.kagoshima-kankou.com/guide/10330/","","0994-42-0233","鹿児島県鹿屋市西原3丁目11-2","9：00～17：00（入館は16：30まで）","12/29～1/3","入館料無料","［バス］ ・鹿児島空港から鹿屋航空隊前まで約100分 ・志布志駅から鹿屋航空隊前まで約75分 ［バス・フェリー］ 鹿児島中央駅から鴨池港までバスで約20分、鴨池港から垂水港までフェリーで約35分、バスで鹿屋航空隊前まで約50分","有","https://www.mod.go.jp/msdf/kanoya/toukatu/HPzairyou/1-8siryoukann/1-8siryoukann.html"
"51674","サクラジマアイランドビュー （さくらじまあいらんどびゅー） 登録済み 解除する 行きたい","","","https://www.kagoshima-kankou.com/guide/51674/","","099-257-2117（鹿児島市 交通局 バス事業課）","鹿児島県鹿児島市","Aコース（7便/日）毎時00分桜島港発 Bコース（8便/日）毎時30分桜島港発 ※交互に運行します ※時刻表、運行コースにつきましては公式サイトにてご確認ください。","年中無休 （※荒天時は運休する場合あり）","均一制運賃 大人 230円・小児 120円（小学生以下） ※ICカード乗車券ラピカ（Rapica）、サクラジマアイランドビュー専用一日乗車券、共通利用券「キュート」でもご利用になれます。 お得な観光パス： ◆サクラジマアイランドビュー専用一日乗車券（各停留所で乗り降り自由） 大人500円・小学生以下250円 ◆共通利用券「キュート」 市営バス（カゴシマシティビューやサクラジマアイランドビューを含む）、市電、桜島フェリーに乗り放題の共通利用券。 1日券（大人1,300円、小児650円） 2日券（大人1,900円、小児90円） ※乗車券の販売所等、詳細は公式サイトにてご確認ください","（桜島フェリー 鹿児島港まで） ［車］ ・鹿児島中央駅から約10分 ［バス］ ・鹿児島空港より空港バスで約50分、「金生町」バス停下車、徒歩約15分 ・鹿児島中央駅より市営バス・南国交通バス・鹿児島交通バスで「水族館前」下車、徒歩約1分 （鹿児島港から桜島港まで） ・桜島フェリーにて約15分","鹿児島港側：無（近隣の有料駐車場をご利用下さい） 桜島港側：有（有料）","http://www.kotsu-city-kagoshima.jp/sakurajima-tabi/#ank5"
"10520","西郷隆盛銅像 （さいごうたかもりどうぞう ） 登録済み 解除する 行きたい","","","https://www.kagoshima-kankou.com/guide/10520/","","","〒892-0853 鹿児島県鹿児島市城山町4-36","","","","・カゴシマシティビュー「西郷銅像前」下車 ・市電「朝日通」から徒歩約8分","","https://www.kagoshima-yokanavi.jp/article/meijiishin"
"11083","日本一の巨樹 蒲生の大クス （ニホンイチノキョジュ カモウノオオクス） 登録済み 解除する 行きたい","","","https://www.kagoshima-kankou.com/guide/11083/","","0995-52-8400（蒲生八幡神社）","鹿児島県姶良市蒲生町上久徳2259-1","","無休","","［車］ ・鹿児島市から約40分 ・鹿児島空港から約30分 ・霧島温泉郷から約50分","有","https://aira-kankou.jp/spot/5566/"
"10689","長崎鼻 （ナガサキバナ） 登録済み 解除する 行きたい","","","https://www.kagoshima-kankou.com/guide/10689/","","0993-22-2111（指宿市観光課）","鹿児島県指宿市山川岡児ヶ水長崎鼻","","","","［車］ ・ＪＲ指宿駅より約25分 ・九州自動車道鹿児島ＩＣより指宿方面へ約70分 ［電車］ ・指宿枕崎線「西大山駅」から車で約15分 ・指宿枕崎線「山川駅」から鹿児島交通バス開聞行きで約15分、長崎鼻前下車徒歩約3分","有","http://www.ibusuki.or.jp/tourism/view/nagasakibana/"
"11053","知覧武家屋敷庭園群 （チランブケヤシキテイエングン） 登録済み 解除する 行きたい","","","https://www.kagoshima-kankou.com/guide/11053/","","0993-58-7878（知覧武家屋敷庭園事務所）","〒897-0302 鹿児島県南九州市知覧町郡13731-1","9：00～17：00","年中無休","［入園料］ 大人 530円 小人（小・中学生）320円","［車］ ・指宿スカイライン知覧ＩＣから車で約15分","有","http://chiran-bukeyashiki.com/"
"12332","鹿児島城（鶴丸城）御楼門 （かごしまじょう つるまるじょう ごろうもん） 登録済み 解除する 行きたい","","","https://www.kagoshima-kankou.com/guide/12332/","","","〒892-0853 鹿児島県鹿児島市城山町7-2","","","","・カゴシマシティビュー「薩摩義士碑前」下車 ・市電「市役所前」から徒歩約10分","","https://www.kagoshima-yokanavi.jp/article/city-view"
"50904","JR西大山駅 （ジェイアールニシオオヤマエキ） 登録済み 解除する 行きたい","","","https://www.kagoshima-kankou.com/guide/50904/","","0993-34-0132（かいもん市場 久太郎内）","鹿児島県指宿市山川大山602","","","","［車］ ・ＪＲ指宿駅から約15分","有","http://www.ibusuki.or.jp/tourism/view/jrnishioyama/"
"52963","神徳稲荷神社 （ジントクイナリジンジャ） 登録済み 解除する 行きたい","","","https://www.kagoshima-kankou.com/guide/52963/","","0994-36-0303","〒893-0063 鹿児島県鹿屋市新栄町1771-4","9：00～17：00(社務時間)","","","［徒歩］ ・鹿屋市役所から約15分","","https://jintokuinari.jp/"
"10094","大浪池 （おおなみのいけ） 登録済み 解除する 行きたい","","","https://www.kagoshima-kankou.com/guide/10094/","","0995-45-5111（霧島市観光PR課）","鹿児島県霧島市牧園町高千穂","通年（火山活動に伴う入山規制は、最新の情報をご確認ください）","","無料","［車］ ・九州自動車道「溝辺鹿児島空港IC」から約45分 ［バス］ ・ＪＲ日豊本線「霧島神宮」駅より、霧島いわさきホテル行きで約30分、「丸尾」乗換え、霧島連山周遊バスで約40分、「大浪池登山口」下車","大浪池登山口付近に駐車場がありますが、台数が限られています。満車の場合は、えびの高原駐車場(500円)をご利用いただき、霧島連山周遊バスにご乗車ください。 ※路上駐車によりキリシマリンドウなど植生への被害や、バスや車の通行の妨げになるなどの影響が出ています。ご協力お願いします。","http://www.city-kirishima.jp/"
"10670","池田湖 （いけだこ） 登録済み 解除する 行きたい","","","https://www.kagoshima-kankou.com/guide/10670/","","0993-22-2111（指宿市観光課）","鹿児島県指宿市池田湖","","","","［車］ ・鹿児島空港から約1時間35分（高速利用） ・鹿児島市から約1時間20分 ・指宿駅から約20分","有（普通車111台）","https://www.ibusuki.or.jp/tourism/view/ikedalake/"
"10740","白谷雲水峡（太鼓岩） （シラタニウンスイキョウ タイコイワ） 登録済み 解除する 行きたい","","","https://www.kagoshima-kankou.com/guide/10740/","","0997-42-3508（屋久島レクリエーションの森保護管理協議会）","鹿児島県熊毛郡屋久島町宮之浦","","無休","［森林環境整備推進協力金］ ・高校生以上 500円 ・団体15名以上 400円 ※2026年4月1日より金額改定 ・高校生以上 800円 ・団体20名以上 600円 ※詳細は公式サイトにてご確認ください","［車］ ・宮之浦港から約25分 ・安房港から約55分 ・屋久島空港から約40分 ※宮之浦港から路線バスもご利用できます。詳細はお問合せください。","有","http://www.town.yakushima.kagoshima.jp/pickup/60706/"
"51414","加世田観光農園 （カセダカンコウノウエン） 登録済み 解除する 行きたい","","","https://www.kagoshima-kankou.com/guide/51414/","","099-487-2100","鹿児島県志布志市松山町新橋1720","9:00～17:00 ※詳細はお問い合わせください","不定休（営業日やご予約は事前にお問い合わせください）","［いちご食べ放題の料金］ 大人 2,000円 小学生 1,500円 園児 600円 2歳以下 300円 ［いちご量り売りの料金］ 100g 200円 ※いちご持ち帰りのみの場合、入園料は不要","［車］ ・曽於弥五郎ICから約25分 ※道の駅松山が目印（道の駅を右手に北上してすぐ）","有り","http://blog.livedoor.jp/kasedafarm/"
"10162","丸池湧水 （マルイケユウスイ） 登録済み 解除する 行きたい","","","https://www.kagoshima-kankou.com/guide/10162/","","0995-74-3111（湧水町商工観光課）","鹿児島県姶良郡湧水町木場589","","","","［車］ ・鹿児島空港から約25分（高速道路） ・九州自動車道・栗野ＩＣを下りて約5分 ・霧島温泉郷から約40分 ・鹿児島中央駅から約50分 ［電車］ ・鹿児島中央駅からＪＲ肥薩線栗野駅まで約1時間40分、駅から徒歩約3分 ［バス］ ・湧水町ふるさとバス観光周り（土日祝・春夏冬休み期間のみ運行）で「栗野駅」下車","有","http://www.town.yusui.kagoshima.jp/site/kanko/898.html"
"12625","焼酎蔵 薩摩金山蔵 （ショウチュウグラ サツマキンザングラ） 登録済み 解除する 行きたい","","","https://www.kagoshima-kankou.com/guide/12625/","","0996-21-2110（薩摩金山蔵）","鹿児島県いちき串木野市野下13665","【売店】10：00～17：00 【蔵見学】トロッコ出発時間 ①11：00～②14：00～ １日2回 ※要予約","平日 ※変更の可能性があるので詳細はお問い合わせ下さい。","入場料無料 坑洞焼酎蔵見学（ツアー）は有料","［車］ ・ＪＲ串木野駅より約10分 ・南九州自動車道「串木野インター」下車、国道3号線を川内方面へ約10分 ・鹿児島空港から約60分 ［バス］ ・ＪＲ串木野駅より路線バスで川内方面へ。「野下口」下車、徒歩約5分","","https://www.hamadasyuzou.co.jp/kinzan/"
"52850","甑島 （コシキシマ） 登録済み 解除する 行きたい","","","https://www.kagoshima-kankou.com/guide/52850/","","0996-25-1140（さつませんだい観光局）","鹿児島県薩摩川内市","","","","［フェリー］ ・串木野新港⇔甑島各港 「フェリー ニュー こしき」で最速75分 ・川内港ターミナル⇔甑島各港 「高速船 甑島」で最速50分","","https://satsumasendai.gr.jp/koshiki-sight-seeing/"
"50237","龍宮神社 （リュウグウジンジャ） 登録済み 解除する 行きたい","","","https://www.kagoshima-kankou.com/guide/50237/","","0993-22-2111（指宿市観光課）","鹿児島県指宿市山川岡児ケ水1581-34","","","","［車］ 九州自動車道鹿児島ＩＣより指宿方面へ約70分 ［電車］ 指宿枕崎線「西大山駅」から車で約15分 指宿枕崎線「山川駅」から鹿児島交通バス開聞行きで約15分、長崎鼻前下車徒歩3分","有","http://www.ibusuki.or.jp/tourism/view/ryugushrine/"
"51669","嘉例川駅 （カレイガワエキ） 登録済み 解除する 行きたい","","","https://www.kagoshima-kankou.com/guide/51669/","","0995-45-5111（霧島市観光PR課）","鹿児島県霧島市隼人町嘉例川2174","","無休","","［電車］ ・ＪＲ肥薩線・嘉例川駅 ［車］ ・溝辺鹿児島空港ＩＣより約10分","有","https://www.city-kirishima.jp/kirikan/shisetsu/kanko-leisure/019.html"
"50902","射楯兵主神社（釜蓋神社） （イタテツワモノヌシジンジャ（カマフタジンジャ）） 登録済み 解除する 行きたい","","","https://www.kagoshima-kankou.com/guide/50902/","","0993-38-2127（釜蓋神社管理運営委員会）","〒891-0704 鹿児島県南九州市頴娃町別府6827","","","","［車］ ・南九州市役所より約30分 ・番所鼻自然公園から約5分 ［電車］ ・指宿駅より約50分 ・頴娃大川駅より徒歩約15分","有","https://www.city.minamikyushu.lg.jp/soshikikarasagasu/shokokankoka/kankokoryu/1/300.html"
"50927","えびの高原 （えびのこうげん） 登録済み 解除する 行きたい","","","https://www.kagoshima-kankou.com/guide/50927/","","0984-33-3002（自然公園財団えびの支部）","宮崎県えびの市","","なし","無料","［車］ ・鹿児島空港ＩＣより約1時間 ・九州自動車道えびのＩＣより約35分、宮崎自動車道小林ＩＣより約25分","有（有料）","https://ebino-ecomuseum.go.jp/"
"10126","高千穂峰 （たかちほのみね） 登録済み 解除する 行きたい","","","https://www.kagoshima-kankou.com/guide/10126/","","0995-57-2505（高千穂河原ビジターセンター）","鹿児島県霧島市霧島地域","","","","［バス］ ・ＪＲ日豊本線霧島神宮駅から約40分 ［徒歩］ ・高千穂河原より約90分","","https://www.kagoshima-kankou.com/guide/70264"
"10692","唐船峡そうめん流し （トウセンキョウソウメンナガシ） 登録済み 解除する 行きたい","","","https://www.kagoshima-kankou.com/guide/10692/","","0993-32-2143（市営唐船峡そうめん流し）","鹿児島県指宿市開聞十町5967番地","※詳しくは公式サイトをご覧ください","年中無休","","［車］ ・ＪＲ指宿駅から約25分","有","http://www.ibusuki.or.jp/eat/somen/ibusukicity/"
